"OWNER";"TABLE_NAME";"NUM_ROWS";"DUPLICATED";"COLUMN_ID";"COLUMN_NAME";"DATA_TYPE";"DATA_LENGTH";"NULLABLE";"DATA_SCALE";"AVG_COL_LEN";"NUM_DISTINCT";"NUM_NULLS";"DEFAULT_ON_NULL";"COMMENTS";"CONSTRAINTS"
"SINFA";"NF_AVULSA";2945299;"N";95;"COD_FABRICANTE";"VARCHAR2";60;"Y";;2;793;2943794;"NO";"Código do fabricante estrangeiro";" (: )"
"SINFA";"NF_AVULSA";2945299;"N";42;"COD_IMPORT_EXPORT";"VARCHAR2";12;"Y";;2;3665;2940887;"NO";"Código de importação ou exportação.";" (: )"
"SINFA";"NF_AVULSA";2945299;"N";71;"COD_MODELO";"VARCHAR2";2;"Y";;3;1;1275594;"NO";"Código do Modelo do Documento Fiscal";" (: )"
"SINFA";"NF_AVULSA";2945299;"N";23;"COD_MUNIC_DESTINATARIO";"NUMBER";22;"Y";0;4;3851;203658;"NO";"Municipio do destinatario";"FK_NF_AVU_DES_R_MUN (FOREIGN KEY: ENABLED)"
"SINFA";"NF_AVULSA";2945299;"N";33;"COD_MUNIC_REMETENTE";"NUMBER";22;"Y";0;5;1370;3497;"NO";"Municipio do remetente";"FK_NF_AVU_REM_R_MUN (FOREIGN KEY: ENABLED)"
"SINFA";"NF_AVULSA";2945299;"N";2;"COD_NATUREZA_OPER";"NUMBER";22;"N";0;4;212;0;"NO";"Código da natureza da operação, também conhecida como Código Fiscal de Operações e Prestações (CFOP).";"FK_NAT_OPE_R_NF_AVU (FOREIGN KEY: ENABLED)- SYS_C0059678 (C: ENABLED)"
"SINFA";"NF_AVULSA";2945299;"N";6;"COD_ORGAO_LOCAL";"NUMBER";22;"Y";0;6;76;702;"NO";"CÓDIGO DO ÓRGÃO LOCAL";"FK_NF_AVU_R_ORG_LOC (FOREIGN KEY: ENABLED)"
"SINFA";"NF_AVULSA";2945299;"N";40;"COD_RECEITA";"NUMBER";22;"Y";0;4;9;0;"NO";"Codigo de receita";"FK_NF_AVU_R_COD_REC (FOREIGN KEY: ENABLED)"
"SINFA";"NF_AVULSA";2945299;"N";79;"COD_UF_DESEMBARACO";"NUMBER";22;"Y";0;2;11;2943794;"NO";"Código UF do desembaraço";" (: )"
"SINFA";"NF_AVULSA";2945299;"N";22;"COD_UF_DESTINATARIO";"NUMBER";22;"Y";0;3;27;4895;"NO";"UF do destinatario";"FK_NF_AVU_DES_R_MUN (FOREIGN KEY: ENABLED)"
"SINFA";"NF_AVULSA";2945299;"N";88;"COD_UF_EMBARQUE";"NUMBER";22;"Y";0;2;9;2943039;"NO";"Código da UF de embarque da exportação";"FK_UF_R_NF_AVU_EMBARQUE (FOREIGN KEY: ENABLED)"
"SINFA";"NF_AVULSA";2945299;"N";97;"COD_UF_ENCOMENDANTE";"NUMBER";22;"Y";0;2;2;2945188;"NO";"Uf do encomendante da importação";" (: )"
"SINFA";"NF_AVULSA";2945299;"N";31;"COD_UF_REMETENTE";"NUMBER";22;"Y";0;3;27;3925;"NO";"UF do remetente";"FK_NF_AVU_REM_R_MUN (FOREIGN KEY: ENABLED)"
"SINFA";"NF_AVULSA";2945299;"N";73;"DAT_AUTORIZACAO_USO";"DATE";7;"Y";;5;1572997;1372302;"NO";"Data de autorização de uso no ambiente nacional.";" (: )"
"SINFA";"NF_AVULSA";2945299;"N";48;"DAT_DESEMBARACO";"DATE";7;"Y";;2;1842;2942164;"NO";"";" (: )"
"SINFA";"NF_AVULSA";2945299;"N";51;"DAT_EMISSAO_DOC_EXPORT";"DATE";7;"Y";;2;808;2943964;"NO";"Data de emiss?o do documento de exporta??o.";" (: )"
"SINFA";"NF_AVULSA";2945299;"N";14;"DAT_ENTRADA_SAIDA";"DATE";7;"Y";;1;0;2945299;"NO";"Data de entrada ou saida";" (: )"
"SINFA";"NF_AVULSA";2945299;"N";63;"DAT_PENDENTE";"DATE";7;"Y";;8;5444;291074;"NO";"data em que a nota ficou pendente de validação.";" (: )"
"SINFA";"NF_AVULSA";2945299;"N";77;"DAT_REGISTRO_IMPORTACAO";"DATE";7;"Y";;2;838;2943794;"NO";"Data do registro de importação";" (: )"
"SINFA";"NF_AVULSA";2945299;"N";12;"DAT_SOLICITACAO";"DATE";7;"Y";;8;6875;0;"NO";"Data da Solicitação";" (: )"
"SINFA";"NF_AVULSA";2945299;"N";59;"DAT_USUARIO_VAL";"DATE";7;"Y";;6;1701248;1215212;"NO";"";" (: )"
"SINFA";"NF_AVULSA";2945299;"N";103;"DH_ENTRADA_CONTINGENCIA";"DATE";7;"Y";;2;9;2944405;"NO";"Data e hora da entrada em contingencia.";" (: )"
"SINFA";"NF_AVULSA";2945299;"N";96;"DSC_CLASSE_IPI";"VARCHAR2";5;"Y";;0;0;2945299;"NO";"Classe de enquadramento do IPI para cigarros e bebidas";" (: )"
"SINFA";"NF_AVULSA";2945299;"N";19;"DSC_COMPL_DESTINATARIO";"VARCHAR2";60;"Y";;4;71112;2120777;"NO";"Descrição do complemento do logradouro do destinatario";" (: )"
"SINFA";"NF_AVULSA";2945299;"N";28;"DSC_COMPL_REMETENTE";"VARCHAR2";60;"Y";;3;21090;2160357;"NO";"Descrição do complemento do logradouro do remetente";" (: )"
"SINFA";"NF_AVULSA";2945299;"N";11;"DSC_DADOS_ADICIONAIS";"VARCHAR2";1024;"Y";;56;666432;1604253;"NO";"Dados Adicionais da Nota Fiscal Avulsa, incluído no ato da validação da nota.";" (: )"
"SINFA";"NF_AVULSA";2945299;"N";101;"DSC_DADOS_ADICIONAIS_INTERNO";"VARCHAR2";4000;"Y";;48;54312;1992370;"NO";"Informações complementares de interesse do SINFA.";" (: )"
"SINFA";"NF_AVULSA";2945299;"N";100;"DSC_DADOS_FISCO";"VARCHAR2";2000;"Y";;0;0;2945299;"NO";"Informações Adicionais de Interesse do Fisco";" (: )"
"SINFA";"NF_AVULSA";2945299;"N";80;"DSC_LOCAL_DESEMBARACO";"VARCHAR2";60;"Y";;2;208;2943794;"NO";"Descrição do local do desembaraço";" (: )"
"SINFA";"NF_AVULSA";2945299;"N";90;"DSC_LOCAL_DESPACHO";"VARCHAR2";60;"Y";;2;155;2944074;"NO";"Local do despacho da exportação";" (: )"
"SINFA";"NF_AVULSA";2945299;"N";89;"DSC_LOCAL_EMBARQUE";"VARCHAR2";60;"Y";;2;149;2943039;"NO";"Local do embarque da exportação";" (: )"
"SINFA";"NF_AVULSA";2945299;"N";99;"DSC_MOTIVO_REJEICAO";"VARCHAR2";250;"Y";;2;1998;2937266;"NO";"Motivo da rejeição da NFA-e";" (: )"
"SINFA";"NF_AVULSA";2945299;"N";104;"JUSTIFICATIVA_CONTINGENCIA";"VARCHAR2";256;"Y";;2;2;2944405;"NO";"Justificativa da entrada em contingencia.";" (: )"
"SINFA";"NF_AVULSA";2945299;"N";36;"NOM_BAIRRO_DESTINATARIO";"VARCHAR2";60;"Y";;10;57248;772;"NO";"nome do bairro do destinatario";" (: )"
"SINFA";"NF_AVULSA";2945299;"N";35;"NOM_BAIRRO_REMETENTE";"VARCHAR2";60;"Y";;11;18228;1728;"NO";"nome do bairro do remetente";" (: )"
"SINFA";"NF_AVULSA";2945299;"N";16;"NOM_DESTINATARIO";"VARCHAR2";60;"Y";;33;406176;726;"NO";"Nome do destinatario";" (: )"
"SINFA";"NF_AVULSA";2945299;"N";75;"NOM_EMAIL_DESTINATARIO";"VARCHAR2";100;"Y";;2;29998;2852784;"NO";"Email do destinatário";" (: )"
"SINFA";"NF_AVULSA";2945299;"N";76;"NOM_EMAIL_REMETENTE";"VARCHAR2";100;"Y";;3;16820;2800674;"NO";"Email do remetente";" (: )"
"SINFA";"NF_AVULSA";2945299;"N";17;"NOM_LOGR_DESTINATARIO";"VARCHAR2";60;"Y";;19;274848;54;"NO";"Nome do logradouro do destinatario";" (: )"
"SINFA";"NF_AVULSA";2945299;"N";26;"NOM_LOGR_REMETENTE";"VARCHAR2";60;"Y";;17;118616;1260;"NO";"Nome do logradouro do remetente";" (: )"
"SINFA";"NF_AVULSA";2945299;"N";24;"NOM_PAIS_DESTINATARIO";"VARCHAR2";30;"Y";;2;702;2942569;"NO";"Pais do destinatario no caso de exportação.";" (: )"
"SINFA";"NF_AVULSA";2945299;"N";32;"NOM_PAIS_REMETENTE";"VARCHAR2";30;"Y";;2;252;2943491;"NO";"Pais do remetente no caso de importação.";" (: )"
"SINFA";"NF_AVULSA";2945299;"N";25;"NOM_REMETENTE";"VARCHAR2";60;"Y";;33;192656;702;"NO";"Nome do remetente";" (: )"
"SINFA";"NF_AVULSA";2945299;"N";39;"NUM_AUTO_INFRACAO";"NUMBER";22;"Y";0;2;70392;2867111;"NO";"Número do Auto de Infracao";" (: )"
"SINFA";"NF_AVULSA";2945299;"N";45;"NUM_CARTEIRA_ARTESAO";"VARCHAR2";7;"Y";;2;2338;2898173;"NO";"Número da certeira de artesão, caso o remetente da nota seja um artesão";" (: )"
"SINFA";"NF_AVULSA";2945299;"N";20;"NUM_CEP_DESTINATARIO";"VARCHAR2";8;"Y";;9;116216;127198;"NO";"Numero do CEP do destinatario";" (: )"
"SINFA";"NF_AVULSA";2945299;"N";29;"NUM_CEP_REMETENTE";"VARCHAR2";8;"Y";;9;20398;86945;"NO";"Numero do CEP do remetente";" (: )"
"SINFA";"NF_AVULSA";2945299;"N";105;"NUM_CGM";"VARCHAR2";15;"Y";;2;7273;2937749;"NO";"";" (: )"
"SINFA";"NF_AVULSA";2945299;"N";69;"NUM_CHAVE_ACESSO";"VARCHAR2";44;"Y";;26;1669705;1275594;"NO";"Número da chave de acesso da NFA-e";" (: )"
"SINFA";"NF_AVULSA";2945299;"N";21;"NUM_FONE_DESTINATARIO";"VARCHAR2";12;"Y";;8;108216;1292942;"NO";"Numero do telefone do destinatario";" (: )"
"SINFA";"NF_AVULSA";2945299;"N";30;"NUM_FONE_REMETENTE";"VARCHAR2";12;"Y";;8;65488;1143385;"NO";"Telefone do remetente";" (: )"
"SINFA";"NF_AVULSA";2945299;"N";18;"NUM_LOGR_DESTINATARIO";"VARCHAR2";30;"Y";;5;16998;589;"NO";"Numero do logradouro do destinatario";" (: )"
"SINFA";"NF_AVULSA";2945299;"N";27;"NUM_LOGR_REMETENTE";"VARCHAR2";30;"Y";;4;10030;1568;"NO";"Numero do logradouro do remetente";" (: )"
"SINFA";"NF_AVULSA";2945299;"N";37;"NUM_NFA";"VARCHAR2";10;"N";;11;2945299;0;"NO";"num nota da fiscal avulsa";"NF_AVULSA_UK1 (UNIQUE: ENABLED)- SYS_C0059685 (C: ENABLED)"
"SINFA";"NF_AVULSA";2945299;"N";44;"NUM_NFA_CREDITO";"VARCHAR2";10;"Y";;2;1065;2944053;"NO";"Número da NFA do crédito.";" (: )"
"SINFA";"NF_AVULSA";2945299;"N";74;"NUM_PROTOCOLO_AUTORIZACAO";"VARCHAR2";17;"Y";;10;1569280;1372302;"NO";"Número do protocolo de autorização no ambiente nacional.";" (: )"
"SINFA";"NF_AVULSA";2945299;"N";70;"NUM_SERIE";"NUMBER";22;"Y";0;3;2;1275594;"NO";"Número de série.";" (: )"
"SINFA";"NF_AVULSA";2945299;"N";106;"SEQ_CENTRO_COMERCIAL";"NUMBER";22;"Y";0;2;4;2944597;"NO";"sequencial do centro comercial";"FK_CEN_COM_R_NFA (FOREIGN KEY: ENABLED)"
"SINFA";"NF_AVULSA";2945299;"N";107;"SEQ_DEBITO";"NUMBER";22;"Y";0;2;702;2944597;"NO";"debito da nota do polo da moda (empreendedor legal) no conta corrente";"FK_DEB_R_NFA (FOREIGN KEY: ENABLED)"
"SINFA";"NF_AVULSA";2945299;"N";1;"SEQ_NFA";"NUMBER";22;"N";0;6;2945299;0;"NO";"Código da NFA";"PK_NF_AVULSA (PRIMARY KEY: ENABLED)- SYS_C0059677 (C: ENABLED)"
"SINFA";"NF_AVULSA";2945299;"N";3;"SEQ_NF_ORIGEM";"NUMBER";22;"Y";0;2;707584;2227159;"NO";"Identificador único de Nota Fiscal Origem.";"FK_NF_AVU_R_NF_ORI (FOREIGN KEY: ENABLED)"
"SINFA";"NF_AVULSA";2945299;"N";87;"SEQ_PAIS_DESTINATARIO";"NUMBER";22;"Y";0;2;75;2943039;"NO";"Código do pais destinatário para casos de exportação";"FK_PAIS_R_NF_AVU_DESTINATARIO (FOREIGN KEY: ENABLED)"
"SINFA";"NF_AVULSA";2945299;"N";86;"SEQ_PAIS_REMETENTE";"NUMBER";22;"Y";0;3;47;1276296;"NO";"Código do país remetente para casos de importação";"FK_PAIS_R_NF_AVU_REMETENTE (FOREIGN KEY: ENABLED)"
"SINFA";"NF_AVULSA";2945299;"N";5;"SEQ_PESSOA_DESTINATARIO";"NUMBER";22;"Y";0;6;371104;4867;"NO";"Relação entre tabelas pessoa e NF_avulsa (destinatário).";" (: )"
"SINFA";"NF_AVULSA";2945299;"N";4;"SEQ_PESSOA_REMETENTE";"NUMBER";22;"Y";0;6;177968;3225;"NO";"Relação entre tabelas pessoa e NF_avulsa (remetente).";" (: )"
"SINFA";"NF_AVULSA";2945299;"N";34;"SEQ_USUARIO";"NUMBER";22;"Y";0;6;98160;702;"NO";"Seqüencial do usuário";"FK_NF_AVU_R_USU (FOREIGN KEY: ENABLED)"
"SINFA";"NF_AVULSA";2945299;"N";58;"SEQ_USUARIO_VAL";"NUMBER";22;"Y";0;4;320;1218748;"NO";"Seqüencial do usuário";"FK_NF_AVU_R_USU_VAL (FOREIGN KEY: ENABLED)"
"SINFA";"NF_AVULSA";2945299;"N";57;"STA_EMITIDO_INTERNET";"NUMBER";22;"Y";0;3;2;0;"NO";"indica que a nota foi emitida via internet (ou intranet caso negativo).";"CKC_STA_EMITIDO_INTER_NF_AVULS (C: ENABLED)"
"SINFA";"NF_AVULSA";2945299;"N";62;"STA_EMITIDO_REP_SDA";"NUMBER";22;"Y";0;3;2;0;"NO";"informa que a noita foi emitida por um representante da secretaria de desenvolvimento agrario - sda.";"CKC_STA_EMITIDO_REP_S_NF_AVULS (C: ENABLED)"
"SINFA";"NF_AVULSA";2945299;"N";49;"STA_MUNIC_DEST_DIVER";"NUMBER";22;"Y";0;2;2;1195902;"NO";"Informa que o destinatario da nota vai ter diversos municipios.";"CKC_STA_MUNIC_DEST_DI_NF_AVULS (C: ENABLED)"
"SINFA";"NF_AVULSA";2945299;"N";13;"STA_NFA";"VARCHAR2";2;"N";;3;10;0;"NO";"Status da Solicitação";"CKC_STA_NFA_NF_AVULS (C: ENABLED)- SYS_C0059683 (C: ENABLED)"
"SINFA";"NF_AVULSA";2945299;"N";61;"STA_NFA_AGRICULTOR";"NUMBER";22;"Y";0;3;2;0;"NO";"indicador de que a nota é de um agricultor.";"CKC_STA_NFA_AGRICULTO_NF_AVULS (C: ENABLED)"
"SINFA";"NF_AVULSA";2945299;"N";67;"STA_NFA_LEILAO";"NUMBER";22;"Y";0;3;2;0;"NO";"nota relativa a leilao.";"CKC_STA_NFA_LEILAO_NF_AVULS (C: ENABLED)"
"SINFA";"NF_AVULSA";2945299;"N";102;"STA_NFA_PRODUCAO_PROPRIA";"NUMBER";22;"Y";0;2;2;1470792;"NO";"Status se é produção própria do MEI";" (: )"
"SINFA";"NF_AVULSA";2945299;"N";68;"STA_NFA_PROG_PNAE";"NUMBER";22;"Y";0;3;2;0;"NO";"Indicador que foi aplicado as regras do programa do Agricultor PNAE na nota.";"CKC_STA_NFA_PROG_PNAE (C: ENABLED)"
"SINFA";"NF_AVULSA";2945299;"N";56;"STA_SUBST_EXTRAVIADA";"NUMBER";22;"Y";0;2;1;2945249;"NO";"Informa se a nota ? substituta de uma NFA extraviada.";" (: )"
"SINFA";"NF_AVULSA";2945299;"N";82;"TIP_ATENDIMENTO";"NUMBER";22;"Y";0;2;2;1275594;"NO";"Tipo de atendimento quanto a presença do comprador no estabelecimento comercial no momento da operação.";"CKC_TIP_ATEND_NF_AVULSA (C: ENABLED)"
"SINFA";"NF_AVULSA";2945299;"N";81;"TIP_CONSUMIDOR";"NUMBER";22;"Y";0;2;2;1275594;"NO";"Indica qual o tipo de consumidor utilizado na operação.";"CKC_TIP_CONS_NF_AVULSA (C: ENABLED)"
"SINFA";"NF_AVULSA";2945299;"N";50;"TIP_DOC_EXPORTACAO";"NUMBER";22;"Y";0;2;7;2943873;"NO";"Tipo de documento de exporta??o.";"CKC_TIP_DOC_EXPORTACA_NF_AVULS (C: ENABLED)"
"SINFA";"NF_AVULSA";2945299;"N";47;"TIP_DOC_IMPORTACAO";"NUMBER";22;"Y";0;2;3;2600739;"NO";"";"CKC_TIP_DOC_IMPORTACA_NF_AVULS (C: ENABLED)"
"SINFA";"NF_AVULSA";2945299;"N";72;"TIP_EMISSAO";"NUMBER";22;"Y";0;3;2;1276296;"NO";"Tipo de Emissão da NF-e";"CKC_TIP_EMISSAO_NFA (C: ENABLED)"
"SINFA";"NF_AVULSA";2945299;"N";108;"TIP_ENTE_GOV";"NUMBER";22;"Y";0;0;0;2945299;"NO";"";" (: )"
"SINFA";"NF_AVULSA";2945299;"N";83;"TIP_FINALIDADE_EMISSAO";"NUMBER";22;"Y";0;3;2;1275594;"NO";"Finalidade de emissão da NF-e";"CKC_TIP_FIN_EMI_NF_AVULSA (C: ENABLED)"
"SINFA";"NF_AVULSA";2945299;"N";84;"TIP_FORMA_PAGAMENTO";"NUMBER";22;"Y";0;2;1;1276296;"NO";"Indicador da forma de pagamento";"CKC_TIP_FOR_PAG_NF_AVULSA (C: ENABLED)"
"SINFA";"NF_AVULSA";2945299;"N";94;"TIP_INTERMEDIO";"NUMBER";22;"Y";0;2;3;2943794;"NO";"Forma de importação quanto a intermediação";"CKC_TIP_INTERMEDIO_NF_AVULS (C: ENABLED)"
"SINFA";"NF_AVULSA";2945299;"N";7;"TIP_NOTA_AVULSA";"VARCHAR2";1;"N";;2;2;0;"NO";"Tipo da NFA, se é de entrada ou saída";"CKC_TIP_NOTA_AVULSA_NF_AVULS (C: ENABLED)- SYS_C0059679 (C: ENABLED)"
"SINFA";"NF_AVULSA";2945299;"N";109;"TIP_OPER_ENTE_GOV";"NUMBER";22;"Y";0;0;0;2945299;"NO";"";" (: )"
"SINFA";"NF_AVULSA";2945299;"N";92;"TIP_VIA_TRANSP";"NUMBER";22;"Y";0;2;7;2943794;"NO";"Via de transporte da mercadoria";"CKC_TIP_VIA_TRANSP_NF_AVULS (C: ENABLED)"
"SINFA";"NF_AVULSA";2945299;"N";93;"VLR_AFRMM";"NUMBER";22;"Y";2;2;126;978693;"NO";"Valor do Adicional ao Frete para Renovação da Marinha Mercante ";" (: )"
"SINFA";"NF_AVULSA";2945299;"N";52;"VLR_AJUSTE_BASE_CALCULO";"NUMBER";22;"Y";2;3;904;0;"NO";"Valor de ajuste da base de calculo.";" (: )"
"SINFA";"NF_AVULSA";2945299;"N";53;"VLR_AJUSTE_ICMS";"NUMBER";22;"Y";2;3;936;0;"NO";"Valor de ajuste do ICMS.";" (: )"
"SINFA";"NF_AVULSA";2945299;"N";55;"VLR_AJUSTE_NFA";"NUMBER";22;"Y";2;3;268;0;"NO";"Valor de ajuste do total da nota.";" (: )"
"SINFA";"NF_AVULSA";2945299;"N";54;"VLR_AJUSTE_PRODUTOS";"NUMBER";22;"Y";2;3;139;0;"NO";"Valor de ajuste do total de produtos.";" (: )"
"SINFA";"NF_AVULSA";2945299;"N";66;"VLR_BASE_CALCULO";"NUMBER";22;"Y";2;3;68768;0;"NO";"valor da base de calculo.";" (: )"
"SINFA";"NF_AVULSA";2945299;"N";15;"VLR_BASE_CALCULO_SUBST";"NUMBER";22;"N";2;3;1606;0;"NO";"Valor  da base de calculo de substituição";"SYS_C0059684 (C: ENABLED)"
"SINFA";"NF_AVULSA";2945299;"N";43;"VLR_CREDITO_ORIGEM";"NUMBER";22;"Y";2;2;1003;2943199;"NO";"Valor do crédito de origem informado pelo usuário.";" (: )"
"SINFA";"NF_AVULSA";2945299;"N";8;"VLR_FRETE";"NUMBER";22;"N";2;3;4732;0;"NO";"valor do frete dos produtos da NFA";"SYS_C0059680 (C: ENABLED)"
"SINFA";"NF_AVULSA";2945299;"N";65;"VLR_ICMS";"NUMBER";22;"Y";2;3;60272;0;"NO";"valor do ICMS.";" (: )"
"SINFA";"NF_AVULSA";2945299;"N";10;"VLR_ICMS_SUBST";"NUMBER";22;"N";2;3;1296;0;"NO";"valor do icms em caso de substitutição";"SYS_C0059682 (C: ENABLED)"
"SINFA";"NF_AVULSA";2945299;"N";38;"VLR_OUTRAS_DESPESAS";"NUMBER";22;"N";2;3;1920;0;"NO";"gastos com outras depesas acessórias";"SYS_C0059686 (C: ENABLED)"
"SINFA";"NF_AVULSA";2945299;"N";9;"VLR_SEGURO";"NUMBER";22;"N";2;3;168;0;"NO";"valor do seguro dos produtos da NFA";"SYS_C0059681 (C: ENABLED)"
"SINFA";"NF_AVULSA";2945299;"N";60;"VLR_TAXA_SISCOMEX";"NUMBER";22;"Y";2;3;103;0;"NO";"valor da taxa do siscomex p/ notas de importacao.";" (: )"
"SINFA";"NF_AVULSA";2945299;"N";64;"VLR_TOTAL";"NUMBER";22;"Y";2;5;281536;0;"NO";"valor total da nota.";" (: )"
"SINFA";"NF_AVULSA_ALTERACAO";164318;"N";4;"DAT_ALTERACAO";"DATE";7;"N";;8;111080;0;"NO";"Data de alteração da NFA.";"SYS_C0059701 (C: ENABLED)"
"SINFA";"NF_AVULSA_ALTERACAO";164318;"N";5;"DSC_JUSTIFICATIVA";"VARCHAR2";1024;"N";;38;83760;0;"NO";"Motivo da alteração.";"SYS_C0059702 (C: ENABLED)"
"SINFA";"NF_AVULSA_ALTERACAO";164318;"N";2;"SEQ_NFA";"NUMBER";22;"N";0;6;130744;0;"NO";"Código da NFA";"FK_NF_AVU_ALT_R_NF_AVU (FOREIGN KEY: ENABLED)- SYS_C0059699 (C: ENABLED)"
"SINFA";"NF_AVULSA_ALTERACAO";164318;"N";1;"SEQ_NF_AVULSA_ALTER";"NUMBER";22;"N";0;5;164318;0;"NO";"Chave da tabela";"PK_NF_AVULSA_ALTERACAO (PRIMARY KEY: ENABLED)- SYS_C0059698 (C: ENABLED)"
"SINFA";"NF_AVULSA_ALTERACAO";164318;"N";3;"SEQ_USUARIO";"NUMBER";22;"N";0;6;33320;0;"NO";"Seqüencial do usuário";"FK_NF_AVU_ALT_R_USU (FOREIGN KEY: ENABLED)- SYS_C0059700 (C: ENABLED)"
"SINFA";"NF_AVULSA_HISTORICO";8448370;"N";4;"DAT_HISTORICO";"DATE";7;"N";;8;8213504;0;"NO";"Data do historico da NFA.";"SYS_C0059706 (C: ENABLED)"
"SINFA";"NF_AVULSA_HISTORICO";8448370;"N";5;"DSC_ACAO";"VARCHAR2";20;"N";;11;17;0;"NO";"Ação utilizada no historico.";"SYS_C0059707 (C: ENABLED)"
"SINFA";"NF_AVULSA_HISTORICO";8448370;"N";6;"DSC_CODIGO_AUTENTICIDADE";"VARCHAR2";19;"Y";;7;2806528;5604860;"NO";"Código de autenticidade gerado.";" (: )"
"SINFA";"NF_AVULSA_HISTORICO";8448370;"N";2;"SEQ_NFA";"NUMBER";22;"N";0;6;2919936;0;"NO";"Código da NFA";"FK_NF_AVU_HIST_R_NF_AVU (FOREIGN KEY: ENABLED)- SYS_C0059705 (C: ENABLED)"
"SINFA";"NF_AVULSA_HISTORICO";8448370;"N";1;"SEQ_NF_AVULSA_HISTORICO";"NUMBER";22;"N";0;6;8448370;0;"NO";"Chave da tabela.";"PK_NF_AVULSA_HISTORICO (PRIMARY KEY: ENABLED)- SYS_C0059704 (C: ENABLED)"
"SINFA";"NF_AVULSA_HISTORICO";8448370;"N";3;"SEQ_USUARIO";"NUMBER";22;"Y";0;6;98496;64958;"NO";"Seqüencial do usuário";"FK_NF_AVU_HIST_R_USU (FOREIGN KEY: ENABLED)"
"SINFA";"NF_AVULSA_HISTORICO";8448370;"N";7;"STA_AUTOR_SINFA";"NUMBER";22;"Y";0;3;2;0;"NO";"";"CKC_STA_AUTOR_SINFA_NF_AVULS (C: ENABLED)"
"SINFA";"NF_AVULSA_22012020_162000";1688868;"N";41;"COD_CGF_DESTINATARIO";"NUMBER";22;"Y";0;4;49612;941588;"NO";"";" (: )"
"SINFA";"NF_AVULSA_22012020_162000";1688868;"N";46;"COD_CGF_REMETENTE";"NUMBER";22;"Y";0;3;23338;1228732;"NO";"";" (: )"
"SINFA";"NF_AVULSA_22012020_162000";1688868;"N";85;"COD_CRT";"NUMBER";22;"Y";0;2;2;1275594;"NO";"";" (: )"
"SINFA";"NF_AVULSA_22012020_162000";1688868;"N";98;"COD_ENCOMENDANTE";"NUMBER";22;"Y";0;2;13;1688845;"NO";"";" (: )"
"SINFA";"NF_AVULSA_22012020_162000";1688868;"N";91;"COD_ESTRANGEIRO";"VARCHAR2";20;"Y";;2;22;1688844;"NO";"";" (: )"
"SINFA";"NF_AVULSA_22012020_162000";1688868;"N";78;"COD_EXPORTADOR";"VARCHAR2";60;"Y";;2;215;1688500;"NO";"";" (: )"
"SINFA";"NF_AVULSA_22012020_162000";1688868;"N";95;"COD_FABRICANTE";"VARCHAR2";60;"Y";;2;215;1688500;"NO";"";" (: )"
"SINFA";"NF_AVULSA_22012020_162000";1688868;"N";42;"COD_IMPORT_EXPORT";"VARCHAR2";12;"Y";;2;2541;1685938;"NO";"";" (: )"
"SINFA";"NF_AVULSA_22012020_162000";1688868;"N";71;"COD_MODELO";"VARCHAR2";2;"Y";;2;1;1275594;"NO";"";" (: )"
"SINFA";"NF_AVULSA_22012020_162000";1688868;"N";23;"COD_MUNIC_DESTINATARIO";"NUMBER";22;"Y";0;4;3154;201825;"NO";"";" (: )"
"SINFA";"NF_AVULSA_22012020_162000";1688868;"N";33;"COD_MUNIC_REMETENTE";"NUMBER";22;"Y";0;5;1370;1671;"NO";"";" (: )"
"SINFA";"NF_AVULSA_22012020_162000";1688868;"N";2;"COD_NATUREZA_OPER";"NUMBER";22;"N";0;4;207;0;"NO";"";"SYS_C001525313 (C: ENABLED)"
"SINFA";"NF_AVULSA_22012020_162000";1688868;"N";6;"COD_ORGAO_LOCAL";"NUMBER";22;"Y";0;6;69;0;"NO";"";" (: )"
"SINFA";"NF_AVULSA_22012020_162000";1688868;"N";40;"COD_RECEITA";"NUMBER";22;"Y";0;4;8;0;"NO";"";" (: )"
"SINFA";"NF_AVULSA_22012020_162000";1688868;"N";79;"COD_UF_DESEMBARACO";"NUMBER";22;"Y";0;2;7;1688500;"NO";"";" (: )"
"SINFA";"NF_AVULSA_22012020_162000";1688868;"N";22;"COD_UF_DESTINATARIO";"NUMBER";22;"Y";0;3;27;2973;"NO";"";" (: )"
"SINFA";"NF_AVULSA_22012020_162000";1688868;"N";88;"COD_UF_EMBARQUE";"NUMBER";22;"Y";0;2;6;1688523;"NO";"";" (: )"
"SINFA";"NF_AVULSA_22012020_162000";1688868;"N";97;"COD_UF_ENCOMENDANTE";"NUMBER";22;"Y";0;2;1;1688841;"NO";"";" (: )"
"SINFA";"NF_AVULSA_22012020_162000";1688868;"N";31;"COD_UF_REMETENTE";"NUMBER";22;"Y";0;3;27;2086;"NO";"";" (: )"
"SINFA";"NF_AVULSA_22012020_162000";1688868;"N";73;"DAT_AUTORIZACAO_USO";"DATE";7;"Y";;3;377440;1309756;"NO";"";" (: )"
"SINFA";"NF_AVULSA_22012020_162000";1688868;"N";48;"DAT_DESEMBARACO";"DATE";7;"Y";;2;1200;1686870;"NO";"";" (: )"
"SINFA";"NF_AVULSA_22012020_162000";1688868;"N";51;"DAT_EMISSAO_DOC_EXPORT";"DATE";7;"Y";;2;496;1688018;"NO";"";" (: )"
"SINFA";"NF_AVULSA_22012020_162000";1688868;"N";14;"DAT_ENTRADA_SAIDA";"DATE";7;"Y";;1;0;1688868;"NO";"";" (: )"
"SINFA";"NF_AVULSA_22012020_162000";1688868;"N";63;"DAT_PENDENTE";"DATE";7;"Y";;7;3278;244762;"NO";"";" (: )"
"SINFA";"NF_AVULSA_22012020_162000";1688868;"N";77;"DAT_REGISTRO_IMPORTACAO";"DATE";7;"Y";;2;223;1688500;"NO";"";" (: )"
"SINFA";"NF_AVULSA_22012020_162000";1688868;"N";12;"DAT_SOLICITACAO";"DATE";7;"Y";;8;4005;0;"NO";"";" (: )"
"SINFA";"NF_AVULSA_22012020_162000";1688868;"N";59;"DAT_USUARIO_VAL";"DATE";7;"Y";;7;1195520;464504;"NO";"";" (: )"
"SINFA";"NF_AVULSA_22012020_162000";1688868;"N";96;"DSC_CLASSE_IPI";"VARCHAR2";5;"Y";;0;0;1688868;"NO";"";" (: )"
"SINFA";"NF_AVULSA_22012020_162000";1688868;"N";19;"DSC_COMPL_DESTINATARIO";"VARCHAR2";60;"Y";;4;35408;1229077;"NO";"";" (: )"
"SINFA";"NF_AVULSA_22012020_162000";1688868;"N";28;"DSC_COMPL_REMETENTE";"VARCHAR2";60;"Y";;3;15961;1255051;"NO";"";" (: )"
"SINFA";"NF_AVULSA_22012020_162000";1688868;"N";11;"DSC_DADOS_ADICIONAIS";"VARCHAR2";1024;"Y";;56;370496;858298;"NO";"";" (: )"
"SINFA";"NF_AVULSA_22012020_162000";1688868;"N";101;"DSC_DADOS_ADICIONAIS_INTERNO";"VARCHAR2";4000;"Y";;20;22916;1463011;"NO";"";" (: )"
"SINFA";"NF_AVULSA_22012020_162000";1688868;"N";100;"DSC_DADOS_FISCO";"VARCHAR2";2000;"Y";;0;0;1688868;"NO";"";" (: )"
"SINFA";"NF_AVULSA_22012020_162000";1688868;"N";80;"DSC_LOCAL_DESEMBARACO";"VARCHAR2";60;"Y";;2;62;1688500;"NO";"";" (: )"
"SINFA";"NF_AVULSA_22012020_162000";1688868;"N";90;"DSC_LOCAL_DESPACHO";"VARCHAR2";60;"Y";;2;63;1688601;"NO";"";" (: )"
"SINFA";"NF_AVULSA_22012020_162000";1688868;"N";89;"DSC_LOCAL_EMBARQUE";"VARCHAR2";60;"Y";;2;66;1688523;"NO";"";" (: )"
"SINFA";"NF_AVULSA_22012020_162000";1688868;"N";99;"DSC_MOTIVO_REJEICAO";"VARCHAR2";250;"Y";;2;717;1686433;"NO";"";" (: )"
"SINFA";"NF_AVULSA_22012020_162000";1688868;"N";36;"NOM_BAIRRO_DESTINATARIO";"VARCHAR2";60;"Y";;10;33772;772;"NO";"";" (: )"
"SINFA";"NF_AVULSA_22012020_162000";1688868;"N";35;"NOM_BAIRRO_REMETENTE";"VARCHAR2";60;"Y";;11;15064;1026;"NO";"";" (: )"
"SINFA";"NF_AVULSA_22012020_162000";1688868;"N";16;"NOM_DESTINATARIO";"VARCHAR2";60;"Y";;33;218096;24;"NO";"";" (: )"
"SINFA";"NF_AVULSA_22012020_162000";1688868;"N";75;"NOM_EMAIL_DESTINATARIO";"VARCHAR2";100;"Y";;2;7014;1672373;"NO";"";" (: )"
"SINFA";"NF_AVULSA_22012020_162000";1688868;"N";76;"NOM_EMAIL_REMETENTE";"VARCHAR2";100;"Y";;2;5645;1655074;"NO";"";" (: )"
"SINFA";"NF_AVULSA_22012020_162000";1688868;"N";17;"NOM_LOGR_DESTINATARIO";"VARCHAR2";60;"Y";;19;155840;54;"NO";"";" (: )"
"SINFA";"NF_AVULSA_22012020_162000";1688868;"N";26;"NOM_LOGR_REMETENTE";"VARCHAR2";60;"Y";;17;90136;558;"NO";"";" (: )"
"SINFA";"NF_AVULSA_22012020_162000";1688868;"N";24;"NOM_PAIS_DESTINATARIO";"VARCHAR2";30;"Y";;2;702;1686138;"NO";"";" (: )"
"SINFA";"NF_AVULSA_22012020_162000";1688868;"N";32;"NOM_PAIS_REMETENTE";"VARCHAR2";30;"Y";;2;252;1687060;"NO";"";" (: )"
"SINFA";"NF_AVULSA_22012020_162000";1688868;"N";25;"NOM_REMETENTE";"VARCHAR2";60;"Y";;31;143680;0;"NO";"";" (: )"
"SINFA";"NF_AVULSA_22012020_162000";1688868;"N";39;"NUM_AUTO_INFRACAO";"NUMBER";22;"Y";0;2;49068;1633971;"NO";"";" (: )"
"SINFA";"NF_AVULSA_22012020_162000";1688868;"N";45;"NUM_CARTEIRA_ARTESAO";"VARCHAR2";7;"Y";;2;2091;1655389;"NO";"";" (: )"
"SINFA";"NF_AVULSA_22012020_162000";1688868;"N";20;"NUM_CEP_DESTINATARIO";"VARCHAR2";8;"Y";;8;54940;127198;"NO";"";" (: )"
"SINFA";"NF_AVULSA_22012020_162000";1688868;"N";29;"NUM_CEP_REMETENTE";"VARCHAR2";8;"Y";;8;16366;86166;"NO";"";" (: )"
"SINFA";"NF_AVULSA_22012020_162000";1688868;"N";69;"NUM_CHAVE_ACESSO";"VARCHAR2";44;"Y";;12;413274;1275594;"NO";"";" (: )"
"SINFA";"NF_AVULSA_22012020_162000";1688868;"N";21;"NUM_FONE_DESTINATARIO";"VARCHAR2";12;"Y";;8;55664;707674;"NO";"";" (: )"
"SINFA";"NF_AVULSA_22012020_162000";1688868;"N";30;"NUM_FONE_REMETENTE";"VARCHAR2";12;"Y";;8;42852;721699;"NO";"";" (: )"
"SINFA";"NF_AVULSA_22012020_162000";1688868;"N";18;"NUM_LOGR_DESTINATARIO";"VARCHAR2";5;"Y";;5;11948;589;"NO";"";" (: )"
"SINFA";"NF_AVULSA_22012020_162000";1688868;"N";27;"NUM_LOGR_REMETENTE";"VARCHAR2";5;"Y";;4;8310;866;"NO";"";" (: )"
"SINFA";"NF_AVULSA_22012020_162000";1688868;"N";37;"NUM_NFA";"VARCHAR2";10;"N";;11;1688192;0;"NO";"";"SYS_C001525320 (C: ENABLED)"
"SINFA";"NF_AVULSA_22012020_162000";1688868;"N";44;"NUM_NFA_CREDITO";"VARCHAR2";10;"Y";;2;1065;1687622;"NO";"";" (: )"
"SINFA";"NF_AVULSA_22012020_162000";1688868;"N";74;"NUM_PROTOCOLO_AUTORIZACAO";"VARCHAR2";15;"Y";;5;379112;1309756;"NO";"";" (: )"
"SINFA";"NF_AVULSA_22012020_162000";1688868;"N";70;"NUM_SERIE";"NUMBER";22;"Y";0;2;1;1275594;"NO";"";" (: )"
"SINFA";"NF_AVULSA_22012020_162000";1688868;"N";1;"SEQ_NFA";"NUMBER";22;"N";0;6;1681792;0;"NO";"";"SYS_C001525312 (C: ENABLED)"
"SINFA";"NF_AVULSA_22012020_162000";1688868;"N";3;"SEQ_NF_ORIGEM";"NUMBER";22;"Y";0;2;136976;1544166;"NO";"";" (: )"
"SINFA";"NF_AVULSA_22012020_162000";1688868;"N";87;"SEQ_PAIS_DESTINATARIO";"NUMBER";22;"Y";0;2;36;1688523;"NO";"";" (: )"
"SINFA";"NF_AVULSA_22012020_162000";1688868;"N";86;"SEQ_PAIS_REMETENTE";"NUMBER";22;"Y";0;2;33;1275594;"NO";"";" (: )"
"SINFA";"NF_AVULSA_22012020_162000";1688868;"N";5;"SEQ_PESSOA_DESTINATARIO";"NUMBER";22;"Y";0;6;199056;2952;"NO";"";" (: )"
"SINFA";"NF_AVULSA_22012020_162000";1688868;"N";4;"SEQ_PESSOA_REMETENTE";"NUMBER";22;"Y";0;6;134832;2088;"NO";"";" (: )"
"SINFA";"NF_AVULSA_22012020_162000";1688868;"N";34;"SEQ_USUARIO";"NUMBER";22;"Y";0;6;59412;0;"NO";"";" (: )"
