"OWNER";"TABLE_NAME";"COLUMN_ID";"COLUMN_NAME";"DATA_TYPE";"DATA_LENGTH";"NULLABLE";"DATA_SCALE";"AVG_COL_LEN";"NUM_DISTINCT";"NUM_NULLS";"DENSITY";"DEFAULT_ON_NULL";"NUM_BUCKETS";"COMMENTS";"CONSTRAINTS"
"SITRAM2";"NOTA_FISCAL_HIST";52;"DSC_JUSTIFICATIVA_STATUS";"VARCHAR2";1024;"Y";;2;328096;1122471079;0,000002;"NO";254;"Justificativa de mudança de situação da nota fiscal, para alguns casos, como retida, liberada, autuada e rejeitada.";" (, )"
"SITRAM2";"NOTA_FISCAL_HIST";53;"STA_ALTERACAO";"NUMBER";22;"N";0;3;2;0;0,5;"NO";1;"Indica se a nota fiscal foi alterada. As mudanças de status não devem alterar esse indicador, e sim qualquer mudança de campo na nota ou nos seus itens.";"SYS_C001506580 (CHECK, ENABLED)"
"SITRAM2";"NOTA_FISCAL_HIST";54;"NUM_DANFE";"VARCHAR2";100;"Y";;45;320307200;1050085;0,00000000312200287723785;"NO";1;"ID da NFE, chave de acesso";" (, )"
"SITRAM2";"NOTA_FISCAL_HIST";55;"STA_NFE_PASSAGEM";"NUMBER";22;"Y";0;3;3;1050617;0,333333333333333;"NO";1;"Indica se a passagem da NFE foi realizada com sucesso a partir do SITRAM.";" (, )"
"SITRAM2";"NOTA_FISCAL_HIST";56;"STA_NFE_ALTERADA";"NUMBER";22;"Y";0;2;2;637201;0,5;"NO";1;"Indica se a NFE carregada na Nota fiscal foi alterada.";" (, )"
"SITRAM2";"NOTA_FISCAL_HIST";57;"NUM_TERMO_RETENCAO";"NUMBER";22;"Y";0;2;14798;1134438875;0,0000675766995539938;"NO";1;"Número do termo de retenção.";" (, )"
"SITRAM2";"NOTA_FISCAL_HIST";58;"NUM_AUTO_INFRACAO";"NUMBER";22;"Y";0;2;11945;1134497022;0,0000837170364169108;"NO";1;"Número do auto de infração.";" (, )"
"SITRAM2";"NOTA_FISCAL_HIST";59;"STA_RETORNO";"NUMBER";22;"N";0;3;2;0;0,5;"NO";1;"Indica se a nota fiscal é de retorno";"SYS_C001506581 (CHECK, ENABLED)"
"SITRAM2";"NOTA_FISCAL_HIST";60;"COD_BARRAS_AUX";"VARCHAR2";36;"Y";;2;178176;1133834569;0,00000561242816091954;"NO";1;"código de barras auxiliar do DANFE de 36 caracteres que tem a seguinte composição:
                                           UF  tpEmis  CNPJ   vNF    ICMSp    ICMSs     DD   DV
Quantidade de caracteres  02      01      14         14       01            01        02    01";" (, )"
"SITRAM2";"NOTA_FISCAL_HIST";61;"NUM_FORM_SEGURANCA";"NUMBER";22;"Y";0;2;3473;1134533922;0,000287935502447452;"NO";1;"Formulários de Segurança  Documento Auxiliar  FS-DA - o número de
formulário representado em código de barras.";" (, )"
"SITRAM2";"NOTA_FISCAL_HIST";62;"VLR_IPI";"NUMBER";22;"Y";2;3;912128;1005178;0,00000109633735616054;"NO";1;"Valor do IPI.";" (, )"
"SITRAM2";"NOTA_FISCAL_HIST";63;"COD_CPF_RESP_RECEB";"NUMBER";22;"Y";0;0;0;1134547681;0;"NO";0;"CPF da pessoa que recebeu a nota fiscal na unidade fiscal.";" (, )"
"SITRAM2";"NOTA_FISCAL_HIST";64;"NOM_RESP_RECEB";"VARCHAR2";60;"Y";;0;0;1134547681;0;"NO";0;"Nome da pessoa que recebeu a nota fiscal na unidade fiscal.";" (, )"
"SITRAM2";"NOTA_FISCAL_HIST";65;"STA_ENTREGUE";"NUMBER";22;"Y";0;3;2;3897;0,5;"NO";1;"Indica que a nota fiscal foi entregue";" (, )"
"SITRAM2";"NOTA_FISCAL_HIST";66;"NUM_IEST";"NUMBER";22;"Y";0;3;34212;835026915;0,0000292295101134105;"NO";1;"Inscrição Estadual do Substituto Tributário do Emitente";" (, )"
"SITRAM2";"NOTA_FISCAL_HIST";67;"STA_NFE_CARTA_CORRECAO";"NUMBER";22;"Y";0;3;2;5357;0,5;"NO";1;"Indica que a NF-e possui carta de correção.";" (, )"
"SITRAM2";"NOTA_FISCAL_HIST";68;"TXT_CPL_INFO_ADIC";"VARCHAR2";4000;"Y";;265;207159296;68587359;0,00000000482720312005694;"NO";1;"Informação complementar da NF-e";" (, )"
"SITRAM2";"NOTA_FISCAL_HIST";69;"TXT_FISCO_INFO_ADIC";"VARCHAR2";2000;"Y";;39;13998080;812444086;0,0000000714383686905633;"NO";1;"Informação complementar da NF-e com informações de interesse ao fisco ";" (, )"
"SITRAM2";"NOTA_FISCAL_HIST";70;"STA_MANTER_CRED_T";"NUMBER";22;"Y";0;2;2;1134181354;0,5;"NO";1;"Se verdadeiro, indica que serão mantidos os lançamentos para a transportadora que possui o Cred-T";" (, )"
"SITRAM2";"NOTA_FISCAL_HIST";71;"DAT_FATO_GERADOR";"DATE";7;"Y";;8;88932352;0;0,0000000112445018883567;"NO";1;"Data do fato gerador";" (, )"
"SITRAM2";"NOTA_FISCAL_HIST";72;"NUM_TOAF";"NUMBER";22;"Y";0;0;0;1134547681;0;"NO";0;"Número do Termo de Ocorrência de Ação Fiscal.";" (, )"
"SITRAM2";"NOTA_FISCAL_HIST";73;"COD_CAE_PRIM_EMI";"NUMBER";22;"Y";0;0;0;1134547681;0;"NO";0;"Código de Atividade Econômica";" (, )"
"SITRAM2";"NOTA_FISCAL_HIST";74;"SEQ_USUARIO_WEB";"NUMBER";22;"Y";0;0;0;1134547681;0;"NO";0;"Seq do usuário da internet";" (, )"
"SITRAM2";"NOTA_FISCAL_HIST";75;"TIP_ALTER_CONTRIB";"NUMBER";22;"Y";0;2;2;523001114;0,5;"NO";1;"Tipo de alteração contribuinte se O-Nao contribuinte e 1-Contribunte que alterou";" (, )"
"SITRAM2";"NOTA_FISCAL_ITEM";1;"SEQ_NOTA_FISCAL_ITEM";"NUMBER";22;"N";0;11;2653702175;0;0;"NO";254;"Identificador unico da instancia de item da nota fiscal.";"PK_NOTA_FISCAL_ITEM (PRIMARY KEY, DISABLED); SYS_C001506485 (CHECK, ENABLED)"
"SITRAM2";"NOTA_FISCAL_ITEM";2;"SEQ_NOTA_FISCAL";"NUMBER";22;"N";0;9;348323840;0;0;"NO";254;"Identificador da Nota Fiscal.";"FK_NOT_FIS_R_NOT_FIS_ITE (FOREIGN KEY, ENABLED); SYS_C001506486 (CHECK, ENABLED)"
"SITRAM2";"NOTA_FISCAL_ITEM";3;"SEQ_ACESSO";"NUMBER";22;"Y";0;7;22839296;4437004;0,0000000437841866929699;"NO";1;"Identificador da ultima alterac?o na tabela de acesso do SISSEG.";"FK_ACE_R_NOT_FIS_ITE (FOREIGN KEY, ENABLED)"
"SITRAM2";"NOTA_FISCAL_ITEM";4;"COD_CONFIG_ORGAO";"NUMBER";22;"Y";0;3;1;4437004;1;"NO";1;"Codigo do Posto ou outro Org?o Local que tenha base de dados local.";"FK_ACE_R_NOT_FIS_ITE (FOREIGN KEY, ENABLED)"
"SITRAM2";"NOTA_FISCAL_ITEM";5;"COD_NCM";"NUMBER";22;"Y";0;6;11920;6270693;0,000025;"NO";254;"Identificador do codigo de NCM do item.";"FK_NCM_R_NOT_FIS_ITE (FOREIGN KEY, ENABLED)"
"SITRAM2";"NOTA_FISCAL_ITEM";6;"SEQ_TIPO_REGIME";"NUMBER";22;"Y";0;2;5;1791096628;0,000000000579639212544966;"NO";5;"Tipo de Regime que foi aplicado ao item no momento do calculo";"FK_TIP_REG_R_NOTA_ITEM (FOREIGN KEY, ENABLED)"
"SITRAM2";"NOTA_FISCAL_ITEM";7;"SEQ_PROC_DOCUMENTO";"NUMBER";22;"Y";0;0;0;2653702175;0;"NO";0;"Identificador de processo ou documento relacionado a alguma excec?o do calculo do ICMS (ex. termo de acordo ou mandado).";"FK_PRO_DOC_R_NOT_FIS_ITE (FOREIGN KEY, ENABLED)"
"SITRAM2";"NOTA_FISCAL_ITEM";8;"SEQ_SITUACAO_TRIBUTARIA_A";"NUMBER";22;"Y";0;3;9;228279;0,000000000188432228692255;"NO";9;"Sequence de Situacao Tributaria A.";"FK_SIT_TRI_A_R_NOT_FIS_ITE (FOREIGN KEY, ENABLED)"
"SITRAM2";"NOTA_FISCAL_ITEM";9;"SEQ_SITUACAO_TRIBUTARIA_B";"NUMBER";22;"Y";0;3;15;177529073;0,000000000201924493726287;"NO";15;"Sequence de Situacao Tributaria B.";"FK_SIT_TRI_B_R_NOT_FIS_ITE (FOREIGN KEY, ENABLED)"
"SITRAM2";"NOTA_FISCAL_ITEM";10;"COD_CFOP";"NUMBER";22;"Y";0;4;439;0;0,000000000188416019216625;"NO";254;"CFOP do item da NF.";"FK_CFO_R_NOT_FIS_ITE (FOREIGN KEY, ENABLED)"
"SITRAM2";"NOTA_FISCAL_ITEM";11;"QTD_ITEM";"NUMBER";22;"N";8;4;1461504;0;0;"NO";254;"Quantidade do produto na linha de item.";"SYS_C001506487 (CHECK, ENABLED)"
"SITRAM2";"NOTA_FISCAL_ITEM";12;"VLR_IPI";"NUMBER";22;"Y";6;2;790208;1942628622;0,00000126548959261359;"NO";1;"Valor do IPI que veio com o produto.";" (, )"
"SITRAM2";"NOTA_FISCAL_ITEM";13;"VLR_ICMS";"NUMBER";22;"Y";6;3;1293184;1562382146;0,000001;"NO";254;"Valor a ser cobrado do ICMS.";" (, )"
"SITRAM2";"NOTA_FISCAL_ITEM";14;"VLR_ICMS_PADRAO";"NUMBER";22;"Y";6;2;471392;2519231365;0,00000212137668861584;"NO";1;"Valor que seria cobrado de ICMS caso a rotina padr?o seja utilizada no calculo, ou seja, nenhum tipo de regra de excec?o foi utilizada.";" (, )"
"SITRAM2";"NOTA_FISCAL_ITEM";15;"VLR_ICMS_DESTACADO";"NUMBER";22;"Y";6;4;2548992;312211537;0,000000392311941347795;"NO";1;"Valor do ICMS Destacado para o item. Pode ser obtido pelo rateio do ICMS Destacado na Nota Fiscal entre os produtos cobrados.";" (, )"
"SITRAM2";"NOTA_FISCAL_ITEM";16;"STA_INSUMO";"NUMBER";22;"N";0;3;2;0;0,5;"NO";1;"Indica se o produto sera utilizado como insumo pelo contribuinte comprador.";"CKC_STA_INS_NOT_FIS_ITE (CHECK, ENABLED); SYS_C001506488 (CHECK, ENABLED)"
"SITRAM2";"NOTA_FISCAL_ITEM";17;"STA_PIS_COFINS";"NUMBER";22;"N";0;3;2;0;0,5;"NO";1;"Indica se deve ser aplicada reduc?o de PIS/COFINS ao item.";"CKC_STA_PIS_COF_NOT_FIS_ITE (CHECK, ENABLED); SYS_C001506489 (CHECK, ENABLED)"
"SITRAM2";"NOTA_FISCAL_ITEM";18;"VLR_DESCONTO";"NUMBER";22;"Y";6;2;891328;2233980752;0,00000112192144754793;"NO";1;"Desconto que deve ser aplicado ao valor total do item antes do calculo do ICMS.";" (, )"
"SITRAM2";"NOTA_FISCAL_ITEM";19;"VLR_DESCONTO_PERC";"NUMBER";22;"Y";2;2;57;4539971;0,0175438596491228;"NO";1;"Porcentagem relativa ao desconto que deve ser aplicado ao valor total do item antes do calculo do ICMS.";" (, )"
"SITRAM2";"NOTA_FISCAL_ITEM";20;"VLR_FECOP";"NUMBER";22;"Y";6;3;178576;1041426;0,00000559985664366992;"NO";1;"Valor de FECOP calculado dependendo do produto.";" (, )"
"SITRAM2";"NOTA_FISCAL_ITEM";21;"VLR_ICMS_FRETE";"NUMBER";22;"Y";6;2;3086592;2358566825;0,000000323981919217052;"NO";1;"Valor calculado do ICMS Frete para o Item.";" (, )"
"SITRAM2";"NOTA_FISCAL_ITEM";22;"STA_CONSUMO";"NUMBER";22;"N";0;3;2;0;0,5;"NO";1;"Indica se o produto sera utilizado como consumo pelo contribuinte comprador.";"CKC_STA_CON_NOT_FIS_ITE (CHECK, ENABLED); SYS_C001506490 (CHECK, ENABLED)"
"SITRAM2";"NOTA_FISCAL_ITEM";23;"DSC_PRODUTO";"VARCHAR2";800;"Y";;38;119603200;42;0;"NO";254;"Descric?o do produto para o caso de exportac?o/exportac?o indireta.";" (, )"
"SITRAM2";"NOTA_FISCAL_ITEM";24;"SEQ_PRODUTO";"NUMBER";22;"Y";0;3;8948;1441761153;0,000009;"NO";254;"";"FK_PRO_R_NOT_FIS_ITE (FOREIGN KEY, ENABLED)"
"SITRAM2";"NOTA_FISCAL_ITEM";25;"STA_HOSPITALAR";"NUMBER";22;"N";0;3;2;0;0,5;"NO";1;"";"CKC_STA_HOSPITALAR_NOTA_FIS (CHECK, ENABLED); SYS_C001506491 (CHECK, ENABLED)"
"SITRAM2";"NOTA_FISCAL_ITEM";26;"STA_OBRA";"NUMBER";22;"N";0;3;2;0;0,5;"NO";1;"";"CKC_STA_OBRA_NOTA_FIS (CHECK, ENABLED); SYS_C001506492 (CHECK, ENABLED)"
"SITRAM2";"NOTA_FISCAL_ITEM";27;"STA_MARGEM_LUCRO";"NUMBER";22;"N";0;3;2;0;0,5;"NO";1;"";"CKC_STA_MARGEM_LUCRO_NOTA_FIS (CHECK, ENABLED); SYS_C001506493 (CHECK, ENABLED)"
"SITRAM2";"NOTA_FISCAL_ITEM";28;"VLR_TOTAL";"NUMBER";22;"Y";6;5;6558208;2183;0,000000152480677648528;"NO";1;"";" (, )"
"SITRAM2";"NOTA_FISCAL_ITEM";29;"STA_COBRANCA_FORCADA";"NUMBER";22;"Y";0;2;2;2625052029;0,5;"NO";1;"";" (, )"
"SITRAM2";"NOTA_FISCAL_ITEM";30;"VLR_FECOP_PADRAO";"NUMBER";22;"Y";6;2;38764;2389584032;0,0000257971313589929;"NO";1;"";" (, )"
"SITRAM2";"NOTA_FISCAL_ITEM";31;"DSC_PRODUTO_SUGESTAO";"VARCHAR2";800;"Y";;2;616;2653700944;0,00162337662337662;"NO";1;"Sugestão de nome do produto a ser utilizado pelo sistema CEVR.";" (, )"
"SITRAM2";"NOTA_FISCAL_ITEM";32;"STA_CREDITO_ORIGEM";"NUMBER";22;"Y";0;3;2;97274;0,5;"NO";1;"Indica se o item possui crédito de origem.";" (, )"
"SITRAM2";"NOTA_FISCAL_ITEM";33;"STA_CEVR";"NUMBER";22;"Y";0;3;2;0;0,5;"NO";1;"Indica se o item veio do CEVR.";"CKC_STA_CEV_NOT_FIS (CHECK, ENABLED)"
"SITRAM2";"NOTA_FISCAL_ITEM";34;"NUM_ITEM";"NUMBER";22;"Y";0;4;982;4354434;0,000242;"NO";254;"Sequencial do item dentro da nota fiscal.";" (, )"
"SITRAM2";"NOTA_FISCAL_ITEM";35;"STA_ATIVO_FIXO";"NUMBER";22;"Y";0;3;2;1112966;0,5;"NO";1;"Indica se o produto será utilizado como ativo pelo contribuinte comprador.";" (, )"
"SITRAM2";"NOTA_FISCAL_ITEM";36;"STA_PADRAO_CEVR";"NUMBER";22;"Y";0;3;2;0;0,5;"NO";1;"Indicador de utilização do padrão de conversão do CEVR.";"CKC_STA_PADRAO_CEVR (CHECK, ENABLED)"
"SITRAM2";"NOTA_FISCAL_ITEM";37;"COD_PRODUTO_CEVR";"VARCHAR2";11;"Y";;3;6212;1506877201;0,000011;"NO";252;"Código informado pelo CEVR.";" (, )"
"SITRAM2";"NOTA_FISCAL_ITEM";38;"TIP_COBRANCA";"NUMBER";22;"Y";0;3;3;626;0,000000000188416063663382;"NO";3;"Tipo de cobranca do item.";"CKC_TIP_COBRANCA_NOTA_FIS (CHECK, ENABLED)"
"SITRAM2";"NOTA_FISCAL_ITEM";39;"COD_CSOSN";"NUMBER";22;"Y";0;2;16;2476382459;0,0625;"NO";1;"Código do CSOSN.";"FK_CSOSN_R_NOT_FIS_ITE (FOREIGN KEY, DISABLED)"
"SITRAM2";"NOTA_FISCAL_ITEM";40;"VLR_ALIQUOTA";"NUMBER";22;"Y";4;3;1604;392448139;0,000623441396508728;"NO";1;"Aliquota do ICMS";" (, )"
"SITRAM2";"NOTA_FISCAL_ITEM";41;"VLR_BC";"NUMBER";22;"Y";2;4;5416960;392412297;0,000000184605387523629;"NO";1;"Valor da Base de Calculo do ICMS";" (, )"
"SITRAM2";"NOTA_FISCAL_ITEM";42;"VLR_UNIT";"NUMBER";22;"Y";10;5;16998400;80144682;0,0000000588290662650602;"NO";1;"Valor unitário de comercialização";" (, )"
"SITRAM2";"NOTA_FISCAL_ITEM";43;"VLR_REDUCAO_BC_PERC";"NUMBER";22;"Y";4;2;6523;2596906672;0,00015330369461904;"NO";1;"";" (, )"
"SITRAM2";"NOTA_FISCAL_ITEM";44;"DSC_UNIDADE";"VARCHAR2";6;"Y";;3;18422;282541378;0,0000542829225925524;"NO";1;"unidade de comercialização";" (, )"
"SITRAM2";"NOTA_FISCAL_ITEM";45;"NUM_CEST";"NUMBER";22;"Y";0;3;10019;1439062060;0,0000998103603154007;"NO";1;"Código de Especificação da Substituição Tributária";" (, )"
"SITRAM2";"NOTA_FISCAL_ITEM";46;"VLR_BC_ICMS_ST";"NUMBER";22;"Y";2;2;1588736;2082040005;0,000000629431195617145;"NO";1;"";" (, )"
"SITRAM2";"NOTA_FISCAL_ITEM";47;"VLR_ICMS_ST";"NUMBER";22;"Y";2;2;774272;2082039640;0,00000129153579103984;"NO";1;"";" (, )"
"SITRAM2";"NOTA_FISCAL_ITEM";48;"MODALIDADE_BC_ICMS_ST";"NUMBER";22;"Y";0;2;8;2082342924;0,125;"NO";1;"";" (, )"
"SITRAM2";"NOTA_FISCAL_ITEM";49;"TIP_OP_VEICULO";"NUMBER";22;"Y";0;2;4;2652275342;0,25;"NO";1;"";" (, )"
"SITRAM2";"NOTA_FISCAL_ITEM";50;"COD_UF_SUBSTITUICAO_VEICULO";"NUMBER";22;"Y";0;2;27;2653498734;0,037037037037037;"NO";1;"";" (, )"
"SITRAM2";"NOTA_FISCAL_ITEM";51;"VLR_ALIQUOTA_IPI";"NUMBER";22;"Y";2;2;1152;2160979478;0,000868055555555556;"NO";1;"";" (, )"
"SITRAM2";"NOTA_FISCAL_ITEM";52;"DSC_IDENTIFICACAO_CATEGORIA";"VARCHAR2";120;"Y";;13;12;1767832918;0,0833333333333333;"NO";1;"Identificação da categoria de produto do COFIP.";" (, )"
"SITRAM2";"NOTA_FISCAL_ITEM";53;"SEQ_USUARIO_WEB";"NUMBER";22;"Y";0;0;0;2653702175;0;"NO";0;"Seq do usuário da internet";" (, )"
"SITRAM2";"NOTA_FISCAL_ITEM";54;"TIP_ALTER_CONTRIB";"NUMBER";22;"Y";0;2;2;1077888336;0,000000000317296363076299;"NO";2;"Tipo de alteração contribuinte se O-Nao contribuinte e 1-Contribunte que alterou";" (, )"
"SITRAM2";"NOTA_FISCAL_ITEM";55;"QTD_PRODUTO_CEVR";"NUMBER";22;"Y";8;2;691776;1992591596;0;"NO";254;"Quantidade do produto na linha de item informado pelo CEVR";" (, )"
"SITRAM2";"NOTA_FISCAL_ITEM";56;"DSC_UNIDADE_COM";"VARCHAR2";6;"Y";;2;10534;2067843899;0,0000949307005885703;"NO";1;"Unidade comercial";" (, )"
"SITRAM2";"NOTA_FISCAL_ITEM";57;"QTD_ITEM_COM";"NUMBER";22;"Y";8;2;603712;2067355725;0,00000165641895473338;"NO";1;"Quantidade comercial";" (, )"
"SITRAM2";"NOTA_FISCAL_ITEM";58;"VLR_UNIT_COM";"NUMBER";22;"Y";10;2;6003712;2067355712;0,000000166563619307522;"NO";1;"Valor unitário comercial";" (, )"
"SITRAM2";"NOTA_FISCAL_ITEM";59;"DSC_UNIDADE_TRIB";"VARCHAR2";6;"Y";;2;10581;2067355726;0,0000945090256119459;"NO";1;"Unidade tributável";" (, )"
"SITRAM2";"NOTA_FISCAL_ITEM";60;"QTD_ITEM_TRIB";"NUMBER";22;"Y";8;2;642304;2067355725;0,0000015568951773615;"NO";1;"Quantidade tributável";" (, )"
"SITRAM2";"NOTA_FISCAL_ITEM";61;"VLR_UNIT_TRIB";"NUMBER";22;"Y";10;2;6410752;2067355725;0,000000155987940260363;"NO";1;"Valor unitário tributável";" (, )"
"SITRAM2";"NOTA_FISCAL_ITEM";62;"STA_UNI_ALT_PROD";"NUMBER";22;"Y";0;2;2;2067355725;0,5;"NO";1;"Indica se o item deve a unidade alterada automaticamente pela informação do cadastro do produto.";" (, )"
"SITRAM2";"NOTA_FISCAL_ITEM";63;"STA_ORI_UNI";"NUMBER";22;"Y";0;2;4;2067355720;0,25;"NO";1;"Origem da informação de unidade";" (, )"
"SITRAM2";"NOTA_FISCAL_ITEM";64;"STA_PROD_SEM_UNI";"NUMBER";22;"Y";0;2;2;2064545056;0,5;"NO";1;"Indica se produto esta sem unidade";" (, )"
"SITRAM2";"NOTA_FISCAL_ITEM_HIST";1;"SEQ_NOTA_FISCAL_ITEM_HIST";"NUMBER";22;"N";0;7;2553373521;0;0,00000000039163874449844;"NO";1;"Identificador da tabela";"PK_NOTA_FISCAL_ITEM_HIST (PRIMARY KEY, ENABLED); SYS_C001506564 (CHECK, ENABLED)"
"SITRAM2";"NOTA_FISCAL_ITEM_HIST";2;"SEQ_NOTA_FISCAL_ITEM";"NUMBER";22;"N";0;11;2458386432;0;0,000000000406770874986671;"NO";1;"Identificador único da instância de item da nota fiscal.";"SYS_C001506565 (CHECK, ENABLED)"
"SITRAM2";"NOTA_FISCAL_ITEM_HIST";3;"SEQ_NOTA_FISCAL";"NUMBER";22;"Y";0;9;331448320;0;0;"NO";254;"Identificador da Nota Fiscal.";" (, )"
"SITRAM2";"NOTA_FISCAL_ITEM_HIST";4;"SEQ_PRODUTO";"NUMBER";22;"Y";0;3;8320;1380069238;0,000011;"NO";254;"Identificador único de instância de Produto.";" (, )"
"SITRAM2";"NOTA_FISCAL_ITEM_HIST";5;"SEQ_ACESSO";"NUMBER";22;"Y";0;7;22652928;5230607;0,0000000441444037609619;"NO";1;"Identificador da última alteração na tabela de acesso do SISSEG.";" (, )"
"SITRAM2";"NOTA_FISCAL_ITEM_HIST";6;"COD_CONFIG_ORGAO";"NUMBER";22;"Y";0;3;1;5230607;1;"NO";1;"Código do Posto ou outro Órgão Local que tenha base de dados local.";" (, )"
"SITRAM2";"NOTA_FISCAL_ITEM_HIST";7;"COD_NCM";"NUMBER";22;"Y";0;6;11692;1652135;0,0000855285665412248;"NO";1;"Identificador do código de NCM do item.";" (, )"
"SITRAM2";"NOTA_FISCAL_ITEM_HIST";8;"SEQ_TIPO_REGIME";"NUMBER";22;"Y";0;2;5;2517214734;0,2;"NO";1;"Tipo de Regime que foi aplicado ao item no momento do cálculo";" (, )"
"SITRAM2";"NOTA_FISCAL_ITEM_HIST";9;"SEQ_PROC_DOCUMENTO";"NUMBER";22;"Y";0;0;0;2553373521;0;"NO";0;"Identificador de processo ou documento relacionado a alguma exceção do cálculo do ICMS (ex. termo de acordo ou mandado).";" (, )"
"SITRAM2";"NOTA_FISCAL_ITEM_HIST";10;"SEQ_SITUACAO_TRIBUTARIA_A";"NUMBER";22;"Y";0;3;9;94062;0,111111111111111;"NO";1;"Sequence de Situacao Tributaria A.";" (, )"
"SITRAM2";"NOTA_FISCAL_ITEM_HIST";11;"SEQ_SITUACAO_TRIBUTARIA_B";"NUMBER";22;"Y";0;3;15;179407728;0,0666666666666667;"NO";1;"Sequence de Situacao Tributaria B.";" (, )"
"SITRAM2";"NOTA_FISCAL_ITEM_HIST";12;"COD_CFOP";"NUMBER";22;"Y";0;4;423;0;0,00236406619385343;"NO";1;"CFOP do item da NF.";" (, )"
"SITRAM2";"NOTA_FISCAL_ITEM_HIST";13;"COD_CSOSN";"NUMBER";22;"Y";0;2;16;2374042548;0,0625;"NO";1;"Código do CSOSN.";" (, )"
"SITRAM2";"NOTA_FISCAL_ITEM_HIST";14;"QTD_ITEM";"NUMBER";22;"Y";8;4;1456256;0;0,000000686692449679177;"NO";1;"Quantidade do produto na linha de item.";" (, )"
"SITRAM2";"NOTA_FISCAL_ITEM_HIST";15;"VLR_TOTAL";"NUMBER";22;"Y";6;5;6295040;2449;0,000000158855225701505;"NO";1;"Valor Total do Item. É digitado.";" (, )"
"SITRAM2";"NOTA_FISCAL_ITEM_HIST";16;"VLR_IPI";"NUMBER";22;"Y";6;2;759552;1873376170;0,00000131656555443209;"NO";1;"Valor do IPI que veio com o produto.";" (, )"
"SITRAM2";"NOTA_FISCAL_ITEM_HIST";17;"VLR_ICMS";"NUMBER";22;"Y";6;2;822976;2482761639;0,00000121510226300645;"NO";1;"Valor a ser cobrado do ICMS.";" (, )"
"SITRAM2";"NOTA_FISCAL_ITEM_HIST";18;"VLR_ICMS_PADRAO";"NUMBER";22;"Y";6;2;148272;2545811866;0,00000674436171360742;"NO";1;"Valor que seria cobrado de ICMS caso a rotina padrão seja utilizada no cálculo, ou seja, nenhum tipo de regra de exceção foi utilizada.";" (, )"
"SITRAM2";"NOTA_FISCAL_ITEM_HIST";19;"VLR_ICMS_DESTACADO";"NUMBER";22;"Y";6;4;1600640;315691759;0,000000624750099960016;"NO";1;"Valor do ICMS Destacado para o item. Pode ser obtido pelo rateio do ICMS Destacado na Nota Fiscal entre os produtos cobrados.";" (, )"
"SITRAM2";"NOTA_FISCAL_ITEM_HIST";20;"STA_INSUMO";"NUMBER";22;"Y";0;3;2;0;0,5;"NO";1;"Indica se o produto será utilizado como insumo pelo contribuinte comprador.";" (, )"
"SITRAM2";"NOTA_FISCAL_ITEM_HIST";21;"STA_PIS_COFINS";"NUMBER";22;"Y";0;3;2;0;0,5;"NO";1;"Indica se deve ser aplicada redução de PIS/COFINS ao item.";" (, )"
"SITRAM2";"NOTA_FISCAL_ITEM_HIST";22;"VLR_DESCONTO";"NUMBER";22;"Y";6;2;838464;2199442700;0,00000119265704908022;"NO";1;"Desconto que deve ser aplicado ao valor total do item antes do cálculo do ICMS.";" (, )"
"SITRAM2";"NOTA_FISCAL_ITEM_HIST";23;"VLR_DESCONTO_PERC";"NUMBER";22;"Y";2;2;1;495173;1;"NO";1;"Porcentagem relativa ao desconto que deve ser aplicado ao valor total do item antes do cálculo do ICMS.";" (, )"
"SITRAM2";"NOTA_FISCAL_ITEM_HIST";24;"VLR_FECOP";"NUMBER";22;"Y";6;3;185168;645912;0,00000540050116650825;"NO";1;"Valor de FECOP calculado dependendo do produto.";" (, )"
"SITRAM2";"NOTA_FISCAL_ITEM_HIST";25;"VLR_FECOP_PADRAO";"NUMBER";22;"Y";6;2;19616;2470297834;0,000050978792822186;"NO";1;"Valor que seria cobrado de FECOP se não houvesse liminar.";" (, )"
"SITRAM2";"NOTA_FISCAL_ITEM_HIST";26;"VLR_ICMS_FRETE";"NUMBER";22;"Y";6;2;1101952;2451851134;0,000000907480543617145;"NO";1;"Valor calculado do ICMS Frete para o Item.";" (, )"
"SITRAM2";"NOTA_FISCAL_ITEM_HIST";27;"STA_CONSUMO";"NUMBER";22;"Y";0;3;2;0;0,5;"NO";1;"Indica se o produto será utilizado como consumo pelo contribuinte comprador.";" (, )"
"SITRAM2";"NOTA_FISCAL_ITEM_HIST";28;"DSC_PRODUTO";"VARCHAR2";800;"Y";;38;107782144;0;0,00000000927797465227635;"NO";1;"Descrição do produto para o caso de exportação/exportação indireta.";" (, )"
"SITRAM2";"NOTA_FISCAL_ITEM_HIST";29;"STA_ATIVO_FIXO";"NUMBER";22;"Y";0;3;2;52;0,5;"NO";1;"Indica se o produto será utilizado como ativo pelo contribuinte comprador.";" (, )"
"SITRAM2";"NOTA_FISCAL_ITEM_HIST";30;"STA_HOSPITALAR";"NUMBER";22;"Y";0;3;2;0;0,5;"NO";1;"Destinado a Hospital";" (, )"
"SITRAM2";"NOTA_FISCAL_ITEM_HIST";31;"STA_OBRA";"NUMBER";22;"Y";0;3;2;0;0,5;"NO";1;"Indica se o Item é ou não de Obra";" (, )"
"SITRAM2";"NOTA_FISCAL_ITEM_HIST";32;"STA_MARGEM_LUCRO";"NUMBER";22;"Y";0;3;2;0;0,5;"NO";1;"Indica se o item trata-se de mercadoria a negociar";" (, )"
"SITRAM2";"NOTA_FISCAL_ITEM_HIST";33;"STA_COBRANCA_FORCADA";"NUMBER";22;"Y";0;2;2;2553368582;0,5;"NO";1;"Indica que o ICMS do item deverá ser calculado sempre, ou seja não permite que o cálculo do item caia na regra sem cobrança.";" (, )"
"SITRAM2";"NOTA_FISCAL_ITEM_HIST";34;"DSC_PRODUTO_SUGESTAO";"VARCHAR2";800;"Y";;2;327;2553372762;0,00305810397553517;"NO";1;"Sugestão de nome do produto a ser utilizado pelo sistema CEVR.";" (, )"
"SITRAM2";"NOTA_FISCAL_ITEM_HIST";35;"STA_CREDITO_ORIGEM";"NUMBER";22;"Y";0;3;2;16;0,5;"NO";1;"Indica se o item possui crédito de origem.";" (, )"
"SITRAM2";"NOTA_FISCAL_ITEM_HIST";36;"STA_CEVR";"NUMBER";22;"Y";0;3;2;0;0,5;"NO";1;"Indica se o item veio do CEVR.";" (, )"
"SITRAM2";"NOTA_FISCAL_ITEM_HIST";37;"NUM_ITEM";"NUMBER";22;"Y";0;4;981;253362;0,000247;"NO";254;"Sequencial do item dentro da nota fiscal.";" (, )"
"SITRAM2";"NOTA_FISCAL_ITEM_HIST";38;"STA_PADRAO_CEVR";"NUMBER";22;"Y";0;3;2;0;0,5;"NO";1;"Indicador de utilização do padrão de conversão do CEVR.";" (, )"
"SITRAM2";"NOTA_FISCAL_ITEM_HIST";39;"COD_PRODUTO_CEVR";"VARCHAR2";11;"Y";;3;5872;1403217297;0,000170299727520436;"NO";1;"Código informado pelo CEVR.";" (, )"
"SITRAM2";"NOTA_FISCAL_ITEM_HIST";40;"TIP_COBRANCA";"NUMBER";22;"Y";0;3;3;0;0,00000000019581937224922;"NO";3;"Tipo de cobranca do item.";" (, )"
"SITRAM2";"NOTA_FISCAL_ITEM_HIST";41;"VLR_ALIQUOTA";"NUMBER";22;"Y";4;3;1516;315712307;0,000659630606860158;"NO";1;"Aliquota do ICMS";" (, )"
"SITRAM2";"NOTA_FISCAL_ITEM_HIST";42;"VLR_BC";"NUMBER";22;"Y";2;4;5328896;315677429;0,000000187656129900077;"NO";1;"Valor da Base de C[alculo do ICMS";" (, )"
"SITRAM2";"NOTA_FISCAL_ITEM_HIST";43;"VLR_UNIT_COM";"NUMBER";22;"Y";10;5;19005440;2040312;0,0000000526165140086207;"NO";1;"Valor unitário de comercializa;ão";" (, )"
"SITRAM2";"NOTA_FISCAL_ITEM_HIST";44;"VLR_REDUCAO_BC_PERC";"NUMBER";22;"Y";4;2;6909;2499542318;0,000144738746562455;"NO";1;"Percentual da redução de BC do ICMS Normal.";" (, )"
"SITRAM2";"NOTA_FISCAL_ITEM_HIST";45;"DAT_MOVIMENTO";"DATE";7;"N";;8;102367232;0;0,0000000097687510003201;"NO";1;"Data em que houve a alteração da nota fiscal";"SYS_C001506566 (CHECK, ENABLED)"
"SITRAM2";"NOTA_FISCAL_ITEM_HIST";46;"STA_OPERACAO";"NUMBER";22;"N";0;3;3;0;0,00000000019581937224922;"NO";3;"Operação realizada no registro da nota fiscal (Inclusão, alteração, exclusão)";"SYS_C001506567 (CHECK, ENABLED)"
"SITRAM2";"NOTA_FISCAL_ITEM_HIST";47;"SEQ_USUARIO_HIST";"NUMBER";22;"Y";0;6;3076;5230607;0,000145;"NO";254;"Identificador do usuário responsável pela alteração.";" (, )"
"SITRAM2";"NOTA_FISCAL_ITEM_HIST";48;"NUM_CEST";"NUMBER";22;"Y";0;0;0;2553373521;0;"NO";0;"Código de Especificação da Substituição Tributária";" (, )"
"SITRAM2";"NOTA_FISCAL_ITEM_HIST";49;"SEQ_USUARIO_WEB";"NUMBER";22;"Y";0;0;0;2553373521;0;"NO";0;"Seq do usuário da internet";" (, )"
"SITRAM2";"NOTA_FISCAL_ITEM_HIST";50;"TIP_ALTER_CONTRIB";"NUMBER";22;"Y";0;2;2;2503834774;0,0000000100931095411032;"NO";2;"Tipo de alteração contribuinte se O-Nao contribuinte e 1-Contribunte que alterou";" (, )"
"SITRAM2";"NOTA_FISCAL_TRANSF_RESP";1;"SEQ_NOTA_FISCAL";"NUMBER";22;"N";0;9;35;0;0,0128205128205128;"NO";35;"Identificador único de instância de Nota Fiscal.";"FK_NOT_FIS_R_NOT_FIS_TRA_RES (FOREIGN KEY, ENABLED); PK_NOTA_FISCAL_TRANSF_RESP (PRIMARY KEY, ENABLED); SYS_C001502611 (CHECK, ENABLED)"
"SITRAM2";"NOTA_FISCAL_TRANSF_RESP";2;"SEQ_TRANSF_RESPONSABILIDADE";"NUMBER";22;"N";0;9;39;0;0,0256410256410256;"NO";1;"Identificador único de instância de Transferência de Responsabilidade.";"FK_TRA_RES_R_NOT_FIS_TRA_RES (FOREIGN KEY, ENABLED); PK_NOTA_FISCAL_TRANSF_RESP (PRIMARY KEY, ENABLED); SYS_C001502612 (CHECK, ENABLED)"
"SITRAM2";"NOTA_OP_ANTERIOR";1;"SEQ_NOTA_OP_ANTERIOR";"NUMBER";22;"N";0;10;25704170;0;0;"NO";254;"Identificador unico da NF da operac?o anterior.";"PK_NOTA_OP_ANTERIOR (PRIMARY KEY, ENABLED); SYS_C00190339 (CHECK, ENABLED)"
"SITRAM2";"NOTA_OP_ANTERIOR";2;"SEQ_NOTA_FISCAL";"NUMBER";22;"Y";0;9;13179904;0;0;"NO";254;"Identificador da Nota Fiscal com CFOP que exige a informac?o das notas fiscais da operac?o anterior. Ex. Nota Fiscal com CFOP de devoluc?o ou venda em consignac?o.";"FK_NOT_FIS_R_NOT_OP_ANT (FOREIGN KEY, ENABLED)"
"SITRAM2";"NOTA_OP_ANTERIOR";3;"SEQ_NOTA_OP_ORI";"NUMBER";22;"Y";0;2;429856;24910723;0,00000232636045559443;"NO";1;"Identificador da Nota Fiscal selada na operac?o original. Trazido pelo webservice disparado a partir do posto fiscal. Tornada chave estrangeira quando chega na sede, via sincronismo.";" (, )"
