"OWNER";"TABLE_NAME";"COLUMN_ID";"COLUMN_NAME";"DATA_TYPE";"DATA_LENGTH";"NULLABLE";"DATA_SCALE";"AVG_COL_LEN";"NUM_DISTINCT";"NUM_NULLS";"DENSITY";"DEFAULT_ON_NULL";"NUM_BUCKETS";"COMMENTS";"CONSTRAINTS"
"SITRAM2";"NOTA_FISCAL";26;"NOM_DESTINATARIO";"VARCHAR2";60;"Y";;28;27590656;62972;0;"NO";254;"Nome do destinatario.";" (, )"
"SITRAM2";"NOTA_FISCAL";27;"SEQ_AUTOR";"NUMBER";22;"Y";0;6;1377;0;0,000726216412490922;"NO";1;"Autor da Nota Fiscal";"FK_USU_R_NOT_FIS_AUT (FOREIGN KEY, ENABLED)"
"SITRAM2";"NOTA_FISCAL";28;"COD_UF_EMITENTE";"NUMBER";22;"Y";0;3;28;0;0,00000000130438641437409;"NO";28;"Codigo da Uf do Emitente";"FK_UNI_FED_R_NOT_FIS_EMI (FOREIGN KEY, ENABLED)"
"SITRAM2";"NOTA_FISCAL";29;"COD_UF_DESTINATARIO";"NUMBER";22;"Y";0;3;28;0;0,00000000130438641437409;"NO";28;"Codigo da Uf do Destinatario";"FK_UNI_FED_R_NOT_FIS_DES (FOREIGN KEY, ENABLED)"
"SITRAM2";"NOTA_FISCAL";30;"SEQ_CONTRIBUINTE_EMI";"NUMBER";22;"Y";0;3;64292;195893605;0,000009;"NO";254;"Emitente da nota, caso seja contribuinte com IE.";"FK_CON_R_NOT_FIS_EMI (FOREIGN KEY, ENABLED)"
"SITRAM2";"NOTA_FISCAL";31;"SEQ_CONTRIBUINTE_DES";"NUMBER";22;"Y";0;2;281920;297740145;0,000003;"NO";254;"Destinatario da nota, caso seja contribuinte com IE.";"FK_CON_R_NOT_FIS_DES (FOREIGN KEY, ENABLED)"
"SITRAM2";"NOTA_FISCAL";32;"COD_ORGAO_LOCAL";"NUMBER";22;"N";0;6;68;0;0,00000000130438641437409;"NO";68;"Codigo do org?o local onde a nota fiscal foi digitada ou incorporada.";"FK_ORG_LOC_R_NOT_FIS (FOREIGN KEY, ENABLED); SYS_C001506635 (CHECK, ENABLED)"
"SITRAM2";"NOTA_FISCAL";33;"DAT_INCLUSAO";"DATE";7;"N";;8;124116992;0;0;"NO";254;"Data de inclus?o da Nota Fiscal no sistema.";"SYS_C001506636 (CHECK, ENABLED)"
"SITRAM2";"NOTA_FISCAL";34;"NOM_EMPRESA_EXTERNA";"VARCHAR2";60;"Y";;2;53900;382041272;0,000017;"NO";254;"Nome da empresa importadora ou exportadora. Utilizada apenas nas operac?es de importac?o ou exportac?o.";" (, )"
"SITRAM2";"NOTA_FISCAL";35;"TIP_ORIGEM";"NUMBER";22;"Y";0;3;2;0;0,5;"NO";1;"Origem das informac?es da Nota Fiscal.";"CKC_TIP_ORI_NOT_FIS (CHECK, ENABLED)"
"SITRAM2";"NOTA_FISCAL";36;"STA_SELADA";"NUMBER";22;"Y";0;3;2;1899;0,00000000130439287641414;"NO";2;"Indica se nota fiscal foi ou n?o selada";"CKC_STA_SEL_NOT_FIS (CHECK, ENABLED)"
"SITRAM2";"NOTA_FISCAL";37;"NUM_DEVOLUCOES";"NUMBER";22;"Y";0;2;1;847243;1;"NO";1;"Numero de vezes que a Nota Fiscal apareceu em operac?es de devoluc?o.";" (, )"
"SITRAM2";"NOTA_FISCAL";38;"STA_DEVOLUCAO_TOTAL";"NUMBER";22;"Y";0;2;1;383321985;1;"NO";1;"Indica se, em alguma operac?o de devoluc?o, a nota foi totalmente devolvida.";"CKC_STA_DEV_TOT_NOT_FIS (CHECK, ENABLED)"
"SITRAM2";"NOTA_FISCAL";39;"NUM_CONTRATO_COMODATO";"VARCHAR2";20;"Y";;0;0;383321993;0;"NO";0;"Numero de Contrato para Nota Fiscal de Remessa de Bem Comodato.";" (, )"
"SITRAM2";"NOTA_FISCAL";40;"DSC_JUSTIFICATIVA_STATUS";"VARCHAR2";1024;"Y";;3;364800;371369957;0,00000274122807017544;"NO";1;"Justificativa de mudanc?o de situac?o da nota fiscal, para alguns casos, como retida, liberada, autuada e rejeitada.";" (, )"
"SITRAM2";"NOTA_FISCAL";41;"STA_ALTERACAO";"NUMBER";22;"N";0;3;2;0;0,00000000130438641437409;"NO";2;"Indica se a nota fiscal foi alterada. As mudancas de status n?o devem alterar esse indicador, e sim qualquer mudanca de campo na nota ou nos seus itens.";"CKC_STA_ALT_NOT_FIS (CHECK, ENABLED); SYS_C001506637 (CHECK, ENABLED)"
"SITRAM2";"NOTA_FISCAL";42;"NUM_DANFE";"VARCHAR2";100;"Y";;45;366084096;829190;0;"NO";254;"ID da NFE, chave de acesso";"NOTA_FISCAL_UK1 (UNIQUE, ENABLED)"
"SITRAM2";"NOTA_FISCAL";43;"STA_NFE_PASSAGEM";"NUMBER";22;"Y";0;3;3;775694;0,00000000130703133531034;"NO";3;"Indica se a passagem da NFE foi realizada com sucesso a partir do SITRAM.";"CKC_STA_NFE_PAS_NOT_FIS (CHECK, ENABLED)"
"SITRAM2";"NOTA_FISCAL";44;"STA_NFE_ALTERADA";"NUMBER";22;"Y";0;2;2;636609;0,5;"NO";1;"Indica se a NFE carregada na Nota fiscal foi alterada.";"CKC_STA_NFE_ALT_NOT_FIS (CHECK, ENABLED)"
"SITRAM2";"NOTA_FISCAL";45;"NUM_TERMO_RETENCAO";"NUMBER";22;"Y";0;2;18246;383284100;0,000052;"NO";254;"Numero do termo de retenc?o.";" (, )"
"SITRAM2";"NOTA_FISCAL";46;"NUM_AUTO_INFRACAO";"NUMBER";22;"Y";0;2;12235;383291758;0,0000817327339599509;"NO";1;"Numero do auto de infrac?o.";" (, )"
"SITRAM2";"NOTA_FISCAL";47;"STA_RETORNO";"NUMBER";22;"N";0;3;2;0;0,00000000130438641437409;"NO";2;"Indica se a nota fiscal e de retorno";"CKC_STA_RET_NOT_FIS (CHECK, ENABLED); SYS_C001506638 (CHECK, ENABLED)"
"SITRAM2";"NOTA_FISCAL";48;"COD_BARRAS_AUX";"VARCHAR2";36;"Y";;2;242432;383052519;0,000004;"NO";254;"codigo de barras auxiliar do DANFE de 36 caracteres que tem a seguinte composic?o:
                                           UF  tpEmis  CNPJ   vNF    ICMSp    ICMSs     DD   DV
Quantidade de caracteres  02      01      14         14       01            01        02    01";" (, )"
"SITRAM2";"NOTA_FISCAL";49;"NUM_FORM_SEGURANCA";"NUMBER";22;"Y";0;2;10245;383311565;0,0000976085895558809;"NO";1;"Formularios de Seguranca ? Documento Auxiliar ? FS-DA - o numero de
formulario representado em codigo de barras.";" (, )"
"SITRAM2";"NOTA_FISCAL";50;"VLR_DESCONTO";"NUMBER";22;"Y";2;3;974016;7697590;0,00000102667717984099;"NO";1;"";" (, )"
"SITRAM2";"NOTA_FISCAL";51;"DSC_JUSTIFICATIVA_ALTERACAO";"VARCHAR2";1024;"Y";;2;398816;382207610;0,00000250742196902832;"NO";1;"";" (, )"
"SITRAM2";"NOTA_FISCAL";52;"DSC_JUSTIFICATIVA_RETORNO";"VARCHAR2";1024;"Y";;0;0;383321993;0;"NO";0;"";" (, )"
"SITRAM2";"NOTA_FISCAL";53;"VLR_ICMS_SEGURO";"NUMBER";22;"Y";2;2;38632;7712148;0,0000258852764547525;"NO";1;"";" (, )"
"SITRAM2";"NOTA_FISCAL";54;"VLR_FRETE";"NUMBER";22;"Y";2;3;356832;7710039;0,00000280243924311721;"NO";1;"";" (, )"
"SITRAM2";"NOTA_FISCAL";55;"VLR_IPI";"NUMBER";22;"Y";2;3;963392;9335230;0,00000103799906995283;"NO";1;"Valor do IPI.";" (, )"
"SITRAM2";"NOTA_FISCAL";56;"SEQ_FRETE_AUTONOMO";"NUMBER";22;"Y";0;2;50724;383265343;0,00002;"NO";254;"Identificador único de instância de frete autônomo.";"FK_FRETE_AUT_R_NOTA_FIS (FOREIGN KEY, ENABLED)"
"SITRAM2";"NOTA_FISCAL";57;"COD_CPF_RESP_RECEB";"NUMBER";22;"Y";0;2;3;383321987;0,333333333333333;"NO";1;"CPF da pessoa que recebeu a nota fiscal na unidade fiscal.";" (, )"
"SITRAM2";"NOTA_FISCAL";58;"NOM_RESP_RECEB";"VARCHAR2";60;"Y";;2;3;383321987;0,333333333333333;"NO";1;"Nome da pessoa que recebeu a nota fiscal na unidade fiscal.";" (, )"
"SITRAM2";"NOTA_FISCAL";59;"STA_ENTREGUE";"NUMBER";22;"Y";0;3;2;1887;0,5;"NO";1;"Indica que a nota fiscal foi entregue";" (, )"
"SITRAM2";"NOTA_FISCAL";60;"TXT_CPL_INFO_ADIC";"VARCHAR2";4000;"Y";;247;221118464;45347797;0,00000000452246267412567;"NO";1;"Informação complementar da NF-e";" (, )"
"SITRAM2";"NOTA_FISCAL";61;"NUM_IEST";"NUMBER";22;"Y";0;3;34924;281270452;0,0000286336043981216;"NO";1;"Inscrição Estadual do Substituto Tributário do Emitente";" (, )"
"SITRAM2";"NOTA_FISCAL";62;"STA_NFE_CARTA_CORRECAO";"NUMBER";22;"Y";0;2;2;21642047;0,5;"NO";1;"Indica que a NF-e possui carta de correção.";"CKC_STA_NFE_CARTA_CORRECAO (CHECK, ENABLED)"
"SITRAM2";"NOTA_FISCAL";63;"COD_CRT";"NUMBER";22;"Y";0;3;4;26760063;0,25;"NO";1;"Código do CRT.";"FK_CRT_R_NOT_FIS (FOREIGN KEY, ENABLED)"
"SITRAM2";"NOTA_FISCAL";64;"TXT_FISCO_INFO_ADIC";"VARCHAR2";2000;"Y";;38;14912512;276758383;0,0000000670577834237451;"NO";1;"Informação complementar da NF-e com informações de interesse ao fisco ";" (, )"
"SITRAM2";"NOTA_FISCAL";65;"STA_MANTER_CRED_T";"NUMBER";22;"Y";0;2;2;383108982;0,5;"NO";1;"Se verdadeiro, indica que serão mantidos os lançamentos para a transportadora que possui o Cred-T";" (, )"
"SITRAM2";"NOTA_FISCAL";66;"DAT_FATO_GERADOR";"DATE";7;"Y";;8;109510656;0;0;"NO";254;"Data do fato gerador";" (, )"
"SITRAM2";"NOTA_FISCAL";67;"SEQ_MANIFESTO_CARGA";"NUMBER";22;"Y";0;9;10434560;78022787;0,0000000958353778213935;"NO";1;"Identificador único de instância de Manifesto de Carga.";"FK_NOT_FIS_R_MAN_CAR (FOREIGN KEY, ENABLED)"
"SITRAM2";"NOTA_FISCAL";68;"NUM_TOAF";"NUMBER";22;"Y";0;2;451;383321213;0,00221729490022173;"NO";1;"Número do Termo de Ocorrência de Ação Fiscal.";" (, )"
"SITRAM2";"NOTA_FISCAL";69;"COD_CAE_PRIM_EMI";"NUMBER";22;"Y";0;2;1559;333316598;0,00064143681847338;"NO";1;"Código de Atividade Econômica";"FK_CAE_R_NOT_FIS (FOREIGN KEY, ENABLED)"
"SITRAM2";"NOTA_FISCAL";70;"VLR_ICMS_UF_DEST";"NUMBER";22;"Y";2;2;388416;223747571;0,00000257455923545889;"NO";1;"Valor do ICMS de partilha para a UF do destinatário";" (, )"
"SITRAM2";"NOTA_FISCAL";71;"VLR_ICMS_UF_REMET";"NUMBER";22;"Y";2;2;60536;237188238;0,0000165190960750628;"NO";1;"Valor do ICMS de partilha para a UF do remetente.";" (, )"
"SITRAM2";"NOTA_FISCAL";72;"COD_FINALIDADE";"NUMBER";22;"Y";0;3;4;72417411;0,25;"NO";1;"Código da Finalidade das notas referenciadas.";" (, )"
"SITRAM2";"NOTA_FISCAL";73;"DSC_JUSTIFIC_CANCELAR_DIFAL";"VARCHAR2";1024;"Y";;2;4987;383292023;0,000200521355524363;"NO";1;"Justificativa de cancelamento do DIFAL do frete";" (, )"
"SITRAM2";"NOTA_FISCAL";74;"SEQ_USUARIO_WEB";"NUMBER";22;"Y";0;0;0;383321993;0;"NO";0;"Seq do usuário da internet";" (, )"
"SITRAM2";"NOTA_FISCAL";75;"TIP_ALTER_CONTRIB";"NUMBER";22;"Y";0;2;2;95489572;0,00000000173712189288086;"NO";2;"Tipo de alteração contribuinte se O-Nao contribuinte e 1-Contribunte que alterou";" (, )"
"SITRAM2";"NOTA_FISCAL";76;"NUM_CONTAINER";"VARCHAR2";44;"Y";;2;170800;382860505;0,00000585480093676815;"NO";1;"Numero do container ao qual pertence a Nota Fiscal";" (, )"
"SITRAM2";"NOTA_FISCAL";77;"STA_CONTAINER_MANUAL";"NUMBER";22;"Y";0;2;2;231328650;0,5;"NO";1;"Status para indicar que container foi inserido manualmente";" (, )"
"SITRAM2";"NOTA_FISCAL";78;"STA_TIPO_DIGITACAO";"NUMBER";22;"Y";0;2;2;249495510;0,5;"NO";1;"Indica se a nota foi selada de forma manual (digitada) ou automática (pelo processamento).";" (, )"
"SITRAM2";"NOTA_FISCAL";79;"STA_ALTERADA";"NUMBER";22;"Y";0;2;1;383269715;1;"NO";1;"Indica se a nota fiscal teve os campos awb e container do cte alterados.";" (, )"
"SITRAM2";"NOTA_FISCAL";80;"DAT_REJEICAO";"DATE";7;"Y";;2;269376;381090226;0,00000371228320266096;"NO";1;"Data de Rejeição da Nota Fiscal";"NOTA_FISCAL_UK1 (UNIQUE, ENABLED)"
"SITRAM2";"NOTA_FISCAL_ECOMMERCE";1;"SEQ_NOTA_FISCAL_ECOMMERCE";"NUMBER";22;"N";0;6;88151578;0;0,0000000113440964153812;"NO";1;"Identificador único de instância de Nota Fiscal de E-commerce";"PK_NOTA_FISCAL_ECOMMERCE (PRIMARY KEY, ENABLED); SYS_C001543666 (CHECK, ENABLED)"
"SITRAM2";"NOTA_FISCAL_ECOMMERCE";2;"NUM_CHAVE";"VARCHAR2";100;"N";;45;68206592;0;0;"NO";254;"Refere-se à chave da nota fiscal.";"SYS_C001543667 (CHECK, ENABLED)"
"SITRAM2";"NOTA_FISCAL_ECOMMERCE";3;"DAT_ENVIO_FILA";"DATE";7;"Y";;3;5247488;72746066;0,000000190567372426578;"NO";1;"Data/hora do envio para processamento na fila.";" (, )"
"SITRAM2";"NOTA_FISCAL_ECOMMERCE";4;"DAT_INCLUSAO";"DATE";7;"N";;8;35622912;0;0;"NO";254;"Data/hora da inclusão da nota fiscal ecommerce, oriunda do NFE-integrações";"SYS_C001543668 (CHECK, ENABLED)"
"SITRAM2";"NOTA_FISCAL_ECOMMERCE";5;"DAT_EMISSAO";"DATE";7;"N";;8;6871;0;0,000146;"NO";254;"Data de emissão na nota, deve ser preenchida pelo DFE integrações.";"SYS_C001543669 (CHECK, ENABLED)"
"SITRAM2";"NOTA_FISCAL_ECOMMERCE";6;"NOM_USUARIO_INCLUSAO";"VARCHAR2";100;"N";;5;2;0;0,5;"NO";1;"Usuário que fez a inclusão da nota, usuário do DFE.";"SYS_C001543670 (CHECK, ENABLED)"
"SITRAM2";"NOTA_FISCAL_ECOMMERCE";7;"STA_NOTA_FISCAL_ECOMMERCE";"NUMBER";22;"N";;3;7;0;0,00000000567204820769062;"NO";7;"Status da Nota Fiscal. 
0 - Inicial (ainda não avaliada)
1 - Enviada para processamento
2 - NFe Cancelada
3 - Selada no SITRAM
4 - Destinatario Contribuinte
5 - Destinatario sem CPF/CNPJ
9 - Erro";"CKC_STA_NOTA_FISCAL_E_NOTA_FIS (CHECK, ENABLED); SYS_C001543671 (CHECK, ENABLED)"
"SITRAM2";"NOTA_FISCAL_ECOMMERCE";8;"SEQ_NOTA_FISCAL_FILA";"NUMBER";22;"Y";0;2;48432;88103029;0,0000206475057813016;"NO";1;"Chave estrangeira para informar a linha da NOTA_FISCAL_FILA em que a nota e-commerce será processada.";"FK_NOTA_FIS_FK_NOT_FI_NOTA_FIS (FOREIGN KEY, ENABLED)"
"SITRAM2";"NOTA_FISCAL_ECOMMERCE";9;"SEQ_ACAO_FISCAL";"NUMBER";22;"Y";0;3;14704899;73446679;0,0000000680045473280707;"NO";1;"";"FK_ACA_FIS_R_NOT_FIS_ECOM (FOREIGN KEY, ENABLED)"
"SITRAM2";"NOTA_FISCAL_ECOMMERCE";10;"DSC_ERRO";"VARCHAR2";100;"Y";;2;1;88150210;1;"NO";1;"Descrição do erro de incorporação da NF";" (, )"
"SITRAM2";"NOTA_FISCAL_EVENTO";1;"SEQ_NOTA_FISCAL_EVENTO";"NUMBER";22;"N";0;11;1199534202;0;0;"NO";254;"Identificador unico de evento da nota fiscal.";"PK_NOTA_FISCAL_EVENTO (PRIMARY KEY, ENABLED); SYS_C00190327 (CHECK, ENABLED)"
"SITRAM2";"NOTA_FISCAL_EVENTO";2;"SEQ_NOTA_FISCAL";"NUMBER";22;"N";0;9;375422976;0;0;"NO";254;"Identificador unico da Nota Fiscal do evento";"FK_NOT_FIS_R_NOT_FIS_EVE (FOREIGN KEY, ENABLED); SYS_C00190328 (CHECK, ENABLED)"
"SITRAM2";"NOTA_FISCAL_EVENTO";3;"SEQ_USUARIO";"NUMBER";22;"Y";0;5;4325;352863660;0,000126;"NO";254;"Usuario autor do evento. Quando NULL significa que foi uma ac?o disparada pelo proprio sistema.";"FK_USU_R_NOT_FIS_EVE (FOREIGN KEY, ENABLED)"
"SITRAM2";"NOTA_FISCAL_EVENTO";4;"COD_ORGAO_LOCAL";"NUMBER";22;"Y";0;5;93;289406359;0,000000000549373369736585;"NO";93;"Org?o Local onde o evento ocorreu.";"FK_ORG_LOC_R_NOT_FIS_EVE (FOREIGN KEY, ENABLED)"
"SITRAM2";"NOTA_FISCAL_EVENTO";5;"DAT_EVENTO";"DATE";7;"N";;8;201932800;0;0;"NO";254;"Data/Hora da ocorrencia do evento.";"SYS_C00190330 (CHECK, ENABLED)"
"SITRAM2";"NOTA_FISCAL_EVENTO";6;"TXT_EVENTO";"VARCHAR2";512;"N";;51;87318528;0;0;"NO";254;"Texto explicativo do evento.";"SYS_C00190331 (CHECK, ENABLED)"
"SITRAM2";"NOTA_FISCAL_EVENTO";7;"STA_NOTA_FISCAL";"NUMBER";22;"N";0;4;10;0;0,00000000041682846488774;"NO";10;"Situac?o em que ficou a nota fiscal, apos a ac?o do usuario.";"CKC_STA_NOT_FIS_NOT_FIS_EVE (CHECK, ENABLED); SYS_C00190332 (CHECK, ENABLED)"
"SITRAM2";"NOTA_FISCAL_EVENTO";8;"TIP_EVENTO";"NUMBER";22;"Y";0;2;36;639787802;0,000000000893261662781574;"NO";36;"Tipo do Evento da nota fiscal.";" (, )"
"SITRAM2";"NOTA_FISCAL_FILA";1;"SEQ_NOTA_FISCAL_FILA";"NUMBER";22;"N";0;7;240479792;0;0,0000000041583535634462;"NO";1;"Identificador único da tabela nota fiscal fila";"PK_NOTA_FISCAL_FILA (PRIMARY KEY, ENABLED); SYS_C001526329 (CHECK, ENABLED)"
"SITRAM2";"NOTA_FISCAL_FILA";2;"SEQ_ACAO_FISCAL";"NUMBER";22;"N";0;8;21825536;0;0,0000000458178896499953;"NO";1;"Identificador único de instância de Ação Fiscal.";"FK_NOT_FIS_FIL_R_ACA_FIS (FOREIGN KEY, ENABLED); SYS_C001526330 (CHECK, ENABLED)"
"SITRAM2";"NOTA_FISCAL_FILA";3;"SEQ_NOTA_FISCAL";"NUMBER";22;"Y";0;9;235847680;2207066;0,00000000424002474817645;"NO";1;"Identificador único de instância de Nota Fiscal.";"FK_NOT_FIS_FIL_R_NOT_FIS (FOREIGN KEY, ENABLED)"
"SITRAM2";"NOTA_FISCAL_FILA";4;"DAT_INCLUSAO";"DATE";7;"N";;8;27488256;0;0,0000000363791722545075;"NO";1;"Data/Hora da ocorrência do evento.";"SYS_C001526331 (CHECK, ENABLED)"
"SITRAM2";"NOTA_FISCAL_FILA";5;"STA_NOTA_FISCAL_FILA";"NUMBER";22;"N";0;3;7;0;0,0000000020791767817231;"NO";7;"situacao da nota";"SYS_C001526332 (CHECK, ENABLED)"
"SITRAM2";"NOTA_FISCAL_FILA";6;"NUM_CHAVE";"VARCHAR2";100;"Y";;45;225755136;38967;0;"NO";254;"Refere-se à chave da nota fiscal";" (, )"
"SITRAM2";"NOTA_FISCAL_FILA";7;"SEQ_MANIFESTO_CARGA";"NUMBER";22;"Y";0;10;4968448;24111671;0,000000201270094806265;"NO";1;"Identificador único de instância de Manifesto de Carga.";"FK_NOT_FIS_FIL_R_MAN_CAR (FOREIGN KEY, ENABLED)"
"SITRAM2";"NOTA_FISCAL_FILA";8;"SEQ_ACESSO";"NUMBER";22;"Y";0;7;18055168;10;0,0000000553858042196007;"NO";1;"Identificador da última alteração na tabela de acesso do SISSEG.";"FK_NOT_FIS_FIL_R_ACE (FOREIGN KEY, ENABLED)"
"SITRAM2";"NOTA_FISCAL_FILA";9;"COD_CONFIG_ORGAO";"NUMBER";22;"Y";0;3;1;10;0,00000000207917686818262;"NO";1;"Código do Posto ou outro Órgão Local que tenha base de dados local.";"FK_NOT_FIS_FIL_R_ACE (FOREIGN KEY, ENABLED)"
"SITRAM2";"NOTA_FISCAL_FILA";10;"COD_ORGAO_LOCAL";"NUMBER";22;"Y";0;6;44;51878;0,00000000207962541321221;"NO";44;"CÓDIGO DO ÓRGÃO LOCAL";"FK_NOT_FIS_FIL_R_ORG_LOC (FOREIGN KEY, ENABLED)"
"SITRAM2";"NOTA_FISCAL_FILA";11;"SEQ_CONHECIM_TRANSP";"NUMBER";22;"Y";0;9;170278912;29652360;0,0000000058727178148754;"NO";1;"Identificador único de instância de Conhecimento de Transporte.";"FK_NOT_FIS_FIL_R_CON_TRA (FOREIGN KEY, ENABLED)"
"SITRAM2";"NOTA_FISCAL_FILA";12;"DAT_INICIO_PROCESSAMENTO";"DATE";7;"Y";;8;36896768;1865444;0,0000000271026448712256;"NO";1;"Data Inicio de processamento.";" (, )"
"SITRAM2";"NOTA_FISCAL_FILA";13;"DAT_FIM_PROCESSAMENTO";"DATE";7;"Y";;8;40812544;1910463;0,0000000245022706744279;"NO";1;"Data fim do processamento";" (, )"
"SITRAM2";"NOTA_FISCAL_FILA";14;"NOM_HOSTNAME";"VARCHAR2";50;"Y";;40;31;232667;0,00000000208119035763695;"NO";31;"Nome do servidor onde foi processado por ultimo";" (, )"
"SITRAM2";"NOTA_FISCAL_FILA";15;"QTD_TENTATIVAS_PROCESSAMENTO";"NUMBER";22;"Y";0;3;295;228830;0,00338983050847458;"NO";1;"Quantidade de tentativas de processamento";" (, )"
"SITRAM2";"NOTA_FISCAL_FILA";16;"DSC_ERRO";"VARCHAR2";1024;"Y";;2;208816;238039838;0,000001;"NO";254;"Descrição do erro";" (, )"
"SITRAM2";"NOTA_FISCAL_HIST";1;"SEQ_NOTA_FISCAL_HIST";"NUMBER";22;"N";0;7;1134547681;0;0,000000000881408526716648;"NO";1;"Identificador único de instância de Histórico da Nota Fiscal.";"PK_NOTA_FISCAL_HIST (PRIMARY KEY, ENABLED); SYS_C001506569 (CHECK, ENABLED)"
"SITRAM2";"NOTA_FISCAL_HIST";2;"DAT_MOVIMENTO";"DATE";7;"N";;8;171933696;0;0;"NO";254;"Data em que houve a alteração da nota fiscal";"SYS_C001506570 (CHECK, ENABLED)"
"SITRAM2";"NOTA_FISCAL_HIST";3;"STA_OPERACAO";"NUMBER";22;"N";0;3;3;0;0,000000000440704263358324;"NO";3;"Operação realizada no registro da nota fiscal (Inclusão, alteração, exclusão)";"SYS_C001506571 (CHECK, ENABLED)"
"SITRAM2";"NOTA_FISCAL_HIST";4;"SEQ_USUARIO_HIST";"NUMBER";22;"Y";0;5;3267;327627176;0,000009;"NO";254;"Identificador do usuário responsável pela alteração.";" (, )"
"SITRAM2";"NOTA_FISCAL_HIST";5;"SEQ_NOTA_FISCAL";"NUMBER";22;"N";0;9;330924032;0;0,00000000302184158084959;"NO";1;"Identificador único de instância de Nota Fiscal.";"SYS_C001506572 (CHECK, ENABLED)"
"SITRAM2";"NOTA_FISCAL_HIST";6;"SEQ_ACAO_FISCAL";"NUMBER";22;"Y";0;8;29100032;16;0,0000000343642233795482;"NO";1;"Identificador da Ação Fiscal à qual a Nota faz parte.";" (, )"
"SITRAM2";"NOTA_FISCAL_HIST";7;"SEQ_CONHECIM_TRANSP";"NUMBER";22;"Y";0;9;234979328;159100556;0,00000000425569350508995;"NO";1;"Identificador do Conhecimento ao qual a Nota pode pertencer.";" (, )"
"SITRAM2";"NOTA_FISCAL_HIST";8;"NOM_EMPRESA_EXTERNA";"VARCHAR2";60;"Y";;2;43840;1131163875;0,0000228102189781022;"NO";1;"Nome da empresa importadora ou exportadora. Utilizada apenas nas operações de importação ou exportação.";" (, )"
"SITRAM2";"NOTA_FISCAL_HIST";9;"DAT_INCLUSAO";"DATE";7;"N";;8;96428032;0;0,0000000103704283833149;"NO";1;"Data de inclusão da Nota Fiscal no sistema.";"SYS_C001506573 (CHECK, ENABLED)"
"SITRAM2";"NOTA_FISCAL_HIST";10;"SEQ_ACESSO";"NUMBER";22;"Y";0;5;24455168;327627176;0,0000000408911523323005;"NO";1;"Identificador da última alteração na tabela de acesso do SISSEG.";" (, )"
"SITRAM2";"NOTA_FISCAL_HIST";11;"COD_CONFIG_ORGAO";"NUMBER";22;"Y";0;3;1;298807340;1;"NO";1;"Código do Posto ou outro Órgão Local que tenha base de dados local.";" (, )"
"SITRAM2";"NOTA_FISCAL_HIST";12;"COD_CFOP";"NUMBER";22;"Y";0;4;408;0;0,00245098039215686;"NO";1;"CFOP da Nota Fiscal,";" (, )"
"SITRAM2";"NOTA_FISCAL_HIST";13;"SEQ_PAIS";"NUMBER";22;"Y";0;2;221;1131163883;0,00452488687782805;"NO";1;"País importador ou exportador da mercadoria.";" (, )"
"SITRAM2";"NOTA_FISCAL_HIST";14;"NUM_NOTA_FISCAL";"NUMBER";22;"N";0;6;32053248;0;0,0000000311980863842566;"NO";1;"Número da Nota Fiscal.";"SYS_C001506574 (CHECK, ENABLED)"
"SITRAM2";"NOTA_FISCAL_HIST";15;"TIP_MODELO_DOCUMENTO";"NUMBER";22;"Y";0;4;5;0;0,2;"NO";1;"Modelo do documento, como por exemplo, Nota Fiscal Modelo 1.";" (, )"
"SITRAM2";"NOTA_FISCAL_HIST";16;"NUM_SERIE";"VARCHAR2";4;"Y";;3;1270;19002;0,00078740157480315;"NO";1;"Número de série da Nota Fiscal.";" (, )"
"SITRAM2";"NOTA_FISCAL_HIST";17;"DAT_EMISSAO";"DATE";7;"N";;8;117366784;0;0;"NO";254;"Data de Emissão da Nota Fiscal.";"SYS_C001506575 (CHECK, ENABLED)"
"SITRAM2";"NOTA_FISCAL_HIST";18;"STA_NOTA_FISCAL";"NUMBER";22;"N";0;3;9;0;0,000000000440704263358324;"NO";9;"Situação em que a Nota Fiscal se encontra";"SYS_C001506576 (CHECK, ENABLED)"
"SITRAM2";"NOTA_FISCAL_HIST";19;"VLR_TOTAL_NOTA";"NUMBER";22;"N";2;5;8123904;0;0,000000123093527446902;"NO";1;"Valor Total da Nota Fiscal.";"SYS_C001506577 (CHECK, ENABLED)"
"SITRAM2";"NOTA_FISCAL_HIST";20;"VLR_TOTAL_PRODUTOS";"NUMBER";22;"Y";2;5;7868416;10219;0,000000127090382613222;"NO";1;"Valor Total dos Produtos que foram digitados na Nota Fiscal.";" (, )"
"SITRAM2";"NOTA_FISCAL_HIST";21;"VLR_ICMS_SEGURO";"NUMBER";22;"Y";2;3;34772;1030906;0,0000287587714252847;"NO";1;"Valor do seguro que entra para a base de cálculo do imposto.";" (, )"
"SITRAM2";"NOTA_FISCAL_HIST";22;"VLR_OUT_DESP";"NUMBER";22;"Y";2;3;251376;926475;0,00000397810451276176;"NO";1;"Valor de Outras Despesas que entra para a base de cálculo.";" (, )"
"SITRAM2";"NOTA_FISCAL_HIST";23;"VLR_BC_SUBSTITUICAO";"NUMBER";22;"Y";2;3;2430976;856843;0,000000411357413647852;"NO";1;"Base de Cálculo de Substituição Tributária informada na NF.";" (, )"
"SITRAM2";"NOTA_FISCAL_HIST";24;"VLR_ICMS_SUBST";"NUMBER";22;"Y";2;3;956480;865826;0,00000104550016728003;"NO";1;"ICMS calculado com código de receita de substituição.";" (, )"
"SITRAM2";"NOTA_FISCAL_HIST";25;"VLR_BC";"NUMBER";22;"Y";6;4;6781440;476212;0,000000147461306153265;"NO";1;"Valor total da Base de Cálculo do imposto, informada na NF.";" (, )"
"SITRAM2";"NOTA_FISCAL_HIST";26;"VLR_ICMS_DEST";"NUMBER";22;"Y";2;4;2034688;504034;0,000000491475842979366;"NO";1;"Valor Total do ICMS calculado para a Nota Fiscal.";" (, )"
"SITRAM2";"NOTA_FISCAL_HIST";27;"VLR_FRETE";"NUMBER";22;"Y";2;3;326848;971268;0,00000305952614059135;"NO";1;"O valorFrete faz parte da Base de Cálculo do ICMS a ser cobrando na entrada da mercadoria no Estado.";" (, )"
"SITRAM2";"NOTA_FISCAL_HIST";28;"VLR_DESCONTO";"NUMBER";22;"Y";2;3;884544;1026055;0,00000113052601114246;"NO";1;"Valor do desconto.";" (, )"
"SITRAM2";"NOTA_FISCAL_HIST";29;"STA_CRED_ORIGEM";"NUMBER";22;"N";0;3;2;0;0,5;"NO";1;"Indica se crédito de origem veio retido.";"SYS_C001506578 (CHECK, ENABLED)"
"SITRAM2";"NOTA_FISCAL_HIST";30;"TIP_EMITENTE";"NUMBER";22;"Y";0;3;3;2018058;0,333333333333333;"NO";1;"Tipo do emitente: PF, PJ sem CGF e PJ com CGF.";" (, )"
"SITRAM2";"NOTA_FISCAL_HIST";31;"COD_EMITENTE";"NUMBER";22;"Y";0;9;1001856;2018058;0,000000998147438354414;"NO";1;"CPF, CNPJ ou IE do emitente.";" (, )"
"SITRAM2";"NOTA_FISCAL_HIST";32;"NOM_EMITENTE";"VARCHAR2";60;"Y";;32;1333120;84056;0,000000750120019203072;"NO";1;"Nome do emitente.";" (, )"
"SITRAM2";"NOTA_FISCAL_HIST";33;"TIP_DESTINATARIO";"NUMBER";22;"Y";0;3;3;1284699;0,333333333333333;"NO";1;"Tipo do destinatário: PF, PJ sem CGF e PJ com CGF.";" (, )"
"SITRAM2";"NOTA_FISCAL_HIST";34;"COD_DESTINATARIO";"NUMBER";22;"Y";0;8;19912704;1364938;0;"NO";254;"CPF, CNPJ ou IE do destinatário.";" (, )"
"SITRAM2";"NOTA_FISCAL_HIST";35;"NOM_DESTINATARIO";"VARCHAR2";60;"Y";;28;25634816;46306;0,0000000390094471518735;"NO";1;"Nome do destinatário.";" (, )"
"SITRAM2";"NOTA_FISCAL_HIST";36;"SEQ_AUTOR";"NUMBER";22;"Y";0;6;1306;0;0,000765696784073507;"NO";1;"Autor da Nota Fiscal";" (, )"
"SITRAM2";"NOTA_FISCAL_HIST";37;"SEQ_CONTRIBUINTE_EMI";"NUMBER";22;"Y";0;3;55620;627732571;0,0000179791441927364;"NO";1;"Emitente da nota, caso seja contribuinte com IE.";" (, )"
"SITRAM2";"NOTA_FISCAL_HIST";38;"SEQ_CONTRIBUINTE_DES";"NUMBER";22;"Y";0;3;255984;821890933;0,00000390649415588474;"NO";1;"Destinatário da nota, caso seja contribuinte com IE.";" (, )"
"SITRAM2";"NOTA_FISCAL_HIST";39;"COD_ORGAO_LOCAL";"NUMBER";22;"N";0;6;68;0;0,0147058823529412;"NO";1;"Código do órgão local onde a nota fiscal foi digitada ou incorporada.";"SYS_C001506579 (CHECK, ENABLED)"
"SITRAM2";"NOTA_FISCAL_HIST";40;"COD_UF_DESTINATARIO";"NUMBER";22;"Y";0;3;28;0;0,0357142857142857;"NO";1;"UF do destinatário.";" (, )"
"SITRAM2";"NOTA_FISCAL_HIST";41;"COD_UF_EMITENTE";"NUMBER";22;"Y";0;3;28;0;0,0357142857142857;"NO";1;"UF do emitente.";" (, )"
"SITRAM2";"NOTA_FISCAL_HIST";42;"SEQ_FRETE_AUTONOMO";"NUMBER";22;"Y";0;2;27982;1134448737;0,0000357372596669287;"NO";1;"Identificador único de instância de frete autônomo.";" (, )"
"SITRAM2";"NOTA_FISCAL_HIST";43;"COD_CRT";"NUMBER";22;"Y";0;3;4;2003841;0,25;"NO";1;"Código do CRT.";" (, )"
"SITRAM2";"NOTA_FISCAL_HIST";44;"SEQ_MANIFESTO_CARGA";"NUMBER";22;"Y";0;9;10276864;124293301;0,0000000973059485850937;"NO";1;"Identificador único de instância de Manifesto de Carga.";" (, )"
"SITRAM2";"NOTA_FISCAL_HIST";45;"TIP_ORIGEM";"NUMBER";22;"Y";0;3;2;0;0,5;"NO";1;"Origem das informações da Nota Fiscal.";" (, )"
"SITRAM2";"NOTA_FISCAL_HIST";46;"STA_SELADA";"NUMBER";22;"Y";0;3;2;3904;0,5;"NO";1;"Indica se nota fiscal foi ou não selada";" (, )"
"SITRAM2";"NOTA_FISCAL_HIST";47;"NUM_DEVOLUCOES";"NUMBER";22;"Y";0;2;1;33891;1;"NO";1;"Número de vezes que a Nota Fiscal apareceu em operações de devolução.";" (, )"
"SITRAM2";"NOTA_FISCAL_HIST";48;"STA_DEVOLUCAO_TOTAL";"NUMBER";22;"Y";0;0;0;1134547681;0;"NO";0;"Indica se, em alguma operação de devolução, a nota foi totalmente devolvida.";" (, )"
"SITRAM2";"NOTA_FISCAL_HIST";49;"NUM_CONTRATO_COMODATO";"VARCHAR2";20;"Y";;0;0;1134547681;0;"NO";0;"Número de Contrato para Nota Fiscal de Remessa de Bem Comodato.";" (, )"
"SITRAM2";"NOTA_FISCAL_HIST";50;"DSC_JUSTIFICATIVA_RETORNO";"VARCHAR2";1024;"Y";;0;0;1134547681;0;"NO";0;"Justificativa de retorno da Nota Fiscal";" (, )"
"SITRAM2";"NOTA_FISCAL_HIST";51;"DSC_JUSTIFICATIVA_ALTERACAO";"VARCHAR2";1024;"Y";;2;332320;1133369807;0,000003;"NO";254;"Justificativa de alteração da nota cuja ação esteja homologada";" (, )"
