"OWNER";"TABLE_NAME";"COLUMN_ID";"COLUMN_NAME";"DATA_TYPE";"DATA_LENGTH";"NULLABLE";"DATA_SCALE";"AVG_COL_LEN";"NUM_DISTINCT";"NUM_NULLS";"DENSITY";"DEFAULT_ON_NULL";"NUM_BUCKETS";"COMMENTS";"CONSTRAINTS"
"SITRAM2";"CONHECIM_TRANSP";21;"COD_UF_INICIO";"NUMBER";22;"Y";0;3;28;41370004;0,00000000170600329251811;"NO";28;"UF inicial do conhecimento de transporte";"FK_UNI_FED_R_CON_TRA_INI (FOREIGN KEY, ENABLED)"
"SITRAM2";"CONHECIM_TRANSP";22;"COD_UF_FIM";"NUMBER";22;"Y";0;3;28;41352807;0,00000000170590319646921;"NO";28;"UF final do conhecimento de transporte";"FK_UNI_FED_R_CON_TRA_FIM (FOREIGN KEY, ENABLED)"
"SITRAM2";"CONHECIM_TRANSP";23;"COD_CPF_CNPJ_DEST";"NUMBER";22;"Y";0;7;19095552;44550036;0,0000000523682164307164;"NO";1;"Destinatário do serviço de frete do conhecimento de transporte.";" (, )"
"SITRAM2";"CONHECIM_TRANSP";24;"NOM_DESTINATARIO";"VARCHAR2";60;"Y";;22;33026048;44555192;0,0000000302791299764356;"NO";1;"Nome do destinatário do conhecimento de transporte.";" (, )"
"SITRAM2";"CONHECIM_TRANSP";25;"STA_SIMPLES_NACIONAL";"NUMBER";22;"Y";0;3;2;0;0,5;"NO";1;"Indica se o emitente do CT-e é do simples nacional.";"CKC_STA_SNC_CON_TRA (CHECK, ENABLED)"
"SITRAM2";"CONHECIM_TRANSP";26;"NUM_IEST_TRANSP";"NUMBER";22;"Y";0;2;2720;281009411;0,000071;"NO";254;"Inscrição Estadual do Substituto Tributário do Emitente do CT-e";" (, )"
"SITRAM2";"CONHECIM_TRANSP";27;"TIP_TRANSPORTE";"NUMBER";22;"Y";0;3;7;46000050;0,00000000173338690099765;"NO";7;"Tipo do modal do serviço de frete.";" (, )"
"SITRAM2";"CONHECIM_TRANSP";28;"COD_MUN_INI_PREST";"NUMBER";22;"Y";0;5;4882;87131662;0,000204834084391643;"NO";1;"";" (, )"
"SITRAM2";"CONHECIM_TRANSP";29;"DSC_MUN_INI_PREST";"VARCHAR2";100;"Y";;9;16024;87131662;0,0000624063904143784;"NO";1;"";" (, )"
"SITRAM2";"CONHECIM_TRANSP";30;"COD_MUN_FIM_PREST";"NUMBER";22;"Y";0;5;5568;87131662;0,000179597701149425;"NO";1;"";" (, )"
"SITRAM2";"CONHECIM_TRANSP";31;"DSC_MUN_FIM_PREST";"VARCHAR2";100;"Y";;8;42176;87131662;0,0000237101669195751;"NO";1;"";" (, )"
"SITRAM2";"CONHECIM_TRANSP";32;"NUM_CONTAINER";"VARCHAR2";100;"Y";;2;10828;334436020;0,0000923531584780199;"NO";1;"Número do Container do Conhecimento de Transporte";" (, )"
"SITRAM2";"CONHECIM_TRANSP";33;"DSC_PRODUTO_PREDOMINANTE";"VARCHAR2";150;"Y";;9;3332096;97017364;0,000000300111401352182;"NO";1;"Produto Predominante";" (, )"
"SITRAM2";"CONHECIM_TRANSP";34;"COD_CFOP";"NUMBER";22;"Y";0;4;29;110171567;0,00000000222934515835077;"NO";29;"CFOP do CT-e";" (, )"
"SITRAM2";"CONHECIM_TRANSP";35;"STA_CONHECIM_TRANSP";"NUMBER";22;"Y";0;3;2;109611378;0,5;"NO";1;"Situação em que o CT-e se encontra";" (, )"
"SITRAM2";"CONHECIM_TRANSP";36;"NUM_AUTO_INFRACAO";"NUMBER";22;"Y";0;2;1048;334451236;0,000954198473282443;"NO";1;"Numero do auto de infração";" (, )"
"SITRAM2";"CONHECIM_TRANSP";37;"DSC_JUSTIFICATIVA_STATUS";"VARCHAR2";1024;"Y";;2;1633;334450413;0,000612369871402327;"NO";1;"Justificativa de mudança de situação do CT-e.";" (, )"
"SITRAM2";"CONHECIM_TRANSP";38;"VLR_FRETE_RATEADO";"NUMBER";22;"Y";6;2;186816;334055172;0,00000535286056868791;"NO";1;"Valor referente ao rateio do cte por notas daquele cte";" (, )"
"SITRAM2";"CONHECIM_TRANSP";39;"TIP_CTE";"NUMBER";22;"Y";0;2;4;129538723;0,25;"NO";1;"";" (, )"
"SITRAM2";"CONHECIM_TRANSP";40;"TP_SERV";"NUMBER";22;"Y";0;2;5;133837823;0,00000000249233791769484;"NO";5;"O tipo de serviço do CTE retornado pelo webservice";" (, )"
"SITRAM2";"CONHECIM_TRANSP";41;"VLR_PESO_MDFE";"NUMBER";22;"Y";2;2;22928;331750304;0,0000436147941381717;"NO";1;"O peso em KG declarado no MDFe vinculado ao CTe";" (, )"
"SITRAM2";"CONHECIM_TRANSP";42;"STA_APLI_PAU_CONV";"NUMBER";22;"Y";0;2;2;334446771;0,5;"NO";1;"Indica se o calculo do imposto deve ser feito pela malha";" (, )"
"SITRAM2";"CONHECIM_TRANSP";43;"VLR_BC_PAUTA";"NUMBER";22;"Y";2;2;412736;331751079;0,000002422856256784;"NO";1;"Valor da pauta malha fiscal";" (, )"
"SITRAM2";"CONHECIM_TRANSP";44;"NUM_AWB_MERCADORIA_NF";"NUMBER";22;"Y";0;2;1537664;326885851;0,000000650337134770665;"NO";1;"AWB referente à fiscalização das mercadorias da NF. Não é utilizado para cálculo de ICMS frete";" (, )"
"SITRAM2";"CONHECIM_TRANSP_FRETE";1;"SEQ_CONHECIM_TRANSP_FRETE";"NUMBER";22;"N";0;11;280526084;0;0;"NO";254;"Identificador único de instância de Conhecimento Transporte Frete.";"PK_CONHECIM_TRANSP_FRETE (PRIMARY KEY, ENABLED); SYS_C001529088 (CHECK, ENABLED)"
"SITRAM2";"CONHECIM_TRANSP_FRETE";2;"SEQ_CONHECIM_TRANSP";"NUMBER";22;"N";0;10;235257856;0;0,00000000425065507695522;"NO";1;"Identificador do Conhecimento Transporte.";"SYS_C001529089 (CHECK, ENABLED)"
"SITRAM2";"CONHECIM_TRANSP_FRETE";3;"SEQ_NOTA_FISCAL";"NUMBER";22;"Y";0;9;220676096;5691140;0,00000000453152841710595;"NO";1;"Seqüencial da Nota Fiscal";" (, )"
"SITRAM2";"CONHECIM_TRANSP_FRETE";4;"SEQ_ACAO_FISCAL";"NUMBER";22;"Y";0;8;11222016;0;0,0000000891105484077014;"NO";1;"Acão Fiscal";" (, )"
"SITRAM2";"CONHECIM_TRANSP_FRETE";5;"STA_CONHECIM_TRANSP_FRETE";"NUMBER";22;"Y";0;3;2;0;0,00000000178236545019464;"NO";2;"1 Normal
2 Excluído;";" (, )"
"SITRAM2";"CONTRATO_FIDELID";1;"SEQ_CONTRATO_FIDELID";"NUMBER";22;"N";0;4;705;0;0,00141843971631206;"NO";1;"Identificador Único de instância de Contrato de Fidelidade.";"PK_CONTRATO_FIDELID (PRIMARY KEY, ENABLED); SYS_C00190717 (CHECK, ENABLED)"
"SITRAM2";"CONTRATO_FIDELID";2;"DAT_VALIDADE_FIM";"DATE";7;"N";;8;705;0;0,001417;"NO";254;"Data de Término de Vigência do contrato.";"SYS_C00190718 (CHECK, ENABLED)"
"SITRAM2";"CONTRATO_FIDELID";3;"DAT_VALIDADE_INICIO";"DATE";7;"N";;8;705;0;0,001417;"NO";254;"Data de Início de Vigência do contrato.";"SYS_C00190719 (CHECK, ENABLED)"
"SITRAM2";"CONTRATO_FIDELID";4;"SEQ_CONTR_CONCESSIONARIA";"NUMBER";22;"N";0;6;203;0;0,000709219858156028;"NO";203;"Identificador de contribuinte, no caso de concessionária.";"FK_CON_R_CON_FID_CON (FOREIGN KEY, ENABLED); SYS_C00190720 (CHECK, ENABLED)"
"SITRAM2";"CONTRATO_FIDELID";5;"SEQ_CONTR_MONTADORA";"NUMBER";22;"Y";0;0;0;705;0;"NO";0;"Identificador de contribuinte, no caso de montadora.";"FK_CON_R_CON_FID_MON (FOREIGN KEY, ENABLED)"
"SITRAM2";"CONTRATO_FIDELID";6;"COD_CNPJ_MONTADORA";"NUMBER";22;"N";0;9;137;0;0,000709219858156028;"NO";137;"CNPJ da montadora.";"SYS_C00190721 (CHECK, ENABLED)"
"SITRAM2";"CONTRATO_FIDELID";7;"NOM_MONTADORA";"VARCHAR2";60;"N";;32;90;0;0,000709219858156028;"NO";90;"Nome da montadora.";"SYS_C00190722 (CHECK, ENABLED)"
"SITRAM2";"CRITERIO";1;"SEQ_CRITERIO";"NUMBER";22;"N";0;3;15;0;0,0666666666666667;"NO";1;"Identificador único de um Criterio.";"PK_CRITERIO (PRIMARY KEY, ENABLED); SYS_C001034546 (CHECK, ENABLED)"
"SITRAM2";"CRITERIO";2;"NOM_CRITERIO";"VARCHAR2";800;"N";;19;15;0;0,0333333333333333;"NO";15;"Nome do critério.";"CRITERIO_UK1 (UNIQUE, ENABLED); SYS_C001034547 (CHECK, ENABLED)"
"SITRAM2";"CRITERIO";3;"SEQ_USUARIO";"NUMBER";22;"Y";0;6;5;0;0,2;"NO";1;"Seqüencial do usuário";"FK_USU_R_CRI (FOREIGN KEY, ENABLED)"
"SITRAM2";"CRITICA";1;"SEQ_AVISO";"NUMBER";22;"N";0;4;61;0;0,00819672131147541;"NO";61;"Identificador Unico de instancia de Critica no SITRAM.";"FK_AVI_R_CRI (FOREIGN KEY, ENABLED); PK_CRITICA (PRIMARY KEY, ENABLED); SYS_C00190250 (CHECK, ENABLED)"
"SITRAM2";"CRITICA";2;"COD_CRITICA";"VARCHAR2";20;"N";;19;61;0;0,00819672131147541;"NO";61;"Codigo da critica a ser referenciado no codigo-fonte. Ex. ""CRITICA_CFOP_CONSIGNACAO"".";"CRITICA_UK1 (UNIQUE, ENABLED); SYS_C00190251 (CHECK, ENABLED)"
"SITRAM2";"CRITICA";3;"SEQ_ACESSO";"NUMBER";22;"Y";0;4;28;28;0,0357142857142857;"NO";1;"Identificador da última alteração na tabela de acesso do SISSEG.";"FK_ACE_R_CRI (FOREIGN KEY, ENABLED)"
"SITRAM2";"CRITICA";4;"COD_CONFIG_ORGAO";"NUMBER";22;"Y";0;3;1;28;1;"NO";1;"Código do Posto ou outro Órgão Local que tenha base de dados local.";"FK_ACE_R_CRI (FOREIGN KEY, ENABLED)"
"SITRAM2";"CRITICA";5;"STA_VISIVEL_POSTO_FISCAL";"NUMBER";22;"Y";0;2;2;25;0,0138888888888889;"NO";2;"Condição que indicará se uma crítica deve ser exibida no posto fiscal virtual.";" (, )"
"SITRAM2";"DAE_CALCULADORA";1;"SEQ_DAE_CALCULADORA";"NUMBER";22;"N";0;5;388;0;0,00257731958762886;"NO";1;"Identificador unico da instancia do Dae Calculadora";"PK_DAE_CALCULADORA (PRIMARY KEY, ENABLED); SYS_C001552632 (CHECK, ENABLED)"
"SITRAM2";"DAE_CALCULADORA";2;"SEQ_DAE_EMITIDO";"NUMBER";22;"Y";0;7;327;0;0,002872;"NO";254;"DAE que foi emitido no Receita para documento de crédito do SITRAM";"AK_DAE_CALCULADORA_UK_DAE_CALC (UNIQUE, ENABLED)"
"SITRAM2";"DAE_CALCULADORA";3;"NUM_CHAVE";"VARCHAR2";100;"Y";;45;309;0;0,003043;"NO";254;"'Chave do Documento Fical vinculado aquele DAE";"AK_DAE_CALCULADORA_UK_DAE_CALC (UNIQUE, ENABLED)"
"SITRAM2";"DAE_CALCULADORA";4;"TIP_DOCUMENTO_FISCAL";"VARCHAR2";4;"Y";;4;1;0;1;"NO";1;"Tipo Documento Fiscal, MDFE, CTE, NFE";" (, )"
"SITRAM2";"DEBITO_CONTRIBUINTE";1;"COD_CONTRIBUINTE";"NUMBER";22;"Y";0;7;22764;0;0,000037;"NO";254;"Código do contribuinte";" (, )"
"SITRAM2";"DEBITO_CONTRIBUINTE";2;"DAT_PERIODO";"DATE";7;"Y";;8;110;0;0,00909090909090909;"NO";1;"Período do débito";" (, )"
"SITRAM2";"DEBITO_CONTRIBUINTE";3;"DAT_VENCIMENTO";"DATE";7;"Y";;8;1703;0;0,000587199060481503;"NO";1;"Vencimento do débito";" (, )"
"SITRAM2";"DEBITO_CONTRIBUINTE";4;"COD_RECEITA";"NUMBER";22;"Y";0;4;6;0;0,166666666666667;"NO";1;"Código da receita";" (, )"
"SITRAM2";"DEBITO_CONTRIBUINTE";5;"VLR_ORIGINAL";"NUMBER";22;"Y";2;5;72672;0;0,0000137604579480405;"NO";1;"Valor original do débito";" (, )"
"SITRAM2";"DEBITO_CONTRIBUINTE";6;"VLR_PAGO";"NUMBER";22;"Y";2;3;3811;0;0,000262398320650748;"NO";1;"Valor pago do débito";" (, )"
"SITRAM2";"DEBITO_CONTRIBUINTE";7;"VLR_A_PAGAR";"NUMBER";22;"Y";2;5;71920;0;0,0000139043381535039;"NO";1;"Valor a pagar do débito";" (, )"
"SITRAM2";"DEBITO_CONTRIBUINTE";8;"STA_REFIS";"NUMBER";22;"Y";0;3;2;0;0,5;"NO";1;"Indica se pode utilizar refis";" (, )"
"SITRAM2";"DEBITO_CONTRIBUINTE";9;"VLR_REFIS";"NUMBER";22;"Y";2;5;65824;0;0,0000151920272241128;"NO";1;"Valor que pode utilizar no refis";" (, )"
"SITRAM2";"DEBITO_CONTRIBUINTE";10;"SEQ_NOTA_FISCAL";"NUMBER";22;"N";0;9;194784;0;0,00000513389190077214;"NO";1;"Sequencial da nota fiscal";"PK_DEBITO_CONTRIBUINTE (PRIMARY KEY, ENABLED); SYS_C001527123 (CHECK, ENABLED)"
"SITRAM2";"DEBITO_CONTRIBUINTE";11;"SEQ_LANCAMENTO";"NUMBER";22;"N";0;11;207728;0;0,00000481398752214434;"NO";1;"Sequencial do lancamento";"PK_DEBITO_CONTRIBUINTE (PRIMARY KEY, ENABLED); SYS_C001527124 (CHECK, ENABLED)"
"SITRAM2";"DEBITO_COPAF";1;"COD_DEBITO_COPAF";"NUMBER";22;"N";0;6;22497;0;0,0000444503711605992;"NO";1;"Sequencial criado no COPAF.";"PK_DEBITO_COPAF (PRIMARY KEY, ENABLED); SYS_C00359787 (CHECK, ENABLED)"
"SITRAM2";"DEBITO_COPAF";2;"SEQ_USUARIO";"NUMBER";22;"Y";0;3;214;16032;0,0000773395204949729;"NO";214;"Quem disparou a criação do débito.";"FK_USU_R_DEB_COP (FOREIGN KEY, ENABLED)"
"SITRAM2";"DEBITO_COPAF";3;"DAT_ENVIO";"DATE";7;"N";;8;22497;0;0,000044;"NO";254;"Data de criação do débito no COPAF.";"SYS_C00359788 (CHECK, ENABLED)"
"SITRAM2";"DEBITO_COPAF";4;"SEQ_USUARIO_CANCELAMENTO";"NUMBER";22;"Y";0;2;142;20815;0,000297265160523187;"NO";142;"Quem disparou o cancelamento do parcelamento.";"FK_USU_CAN_R_DEB_COP (FOREIGN KEY, ENABLED)"
"SITRAM2";"DEBITO_COPAF";5;"DAT_CANCELAMENTO";"DATE";7;"Y";;3;4056;17351;0,000246;"NO";254;"Data de cancelamento do parcelamento no COPAF.";" (, )"
"SITRAM2";"DEPOSITO_JUDICIAL";1;"COD_BARRA_DEPOSITO_JUDICIAL";"VARCHAR2";48;"N";;48;1080;0;0,000925925925925926;"NO";1;"Codigo de darra do boleto do deposito judicial";"SYS_C001543530 (CHECK, ENABLED)"
"SITRAM2";"DEPOSITO_JUDICIAL";2;"DAT_CADASTRO";"DATE";7;"Y";;8;172;0;0,00581395348837209;"NO";1;"Data do boleto do deposito judicial";" (, )"
"SITRAM2";"DEPOSITO_JUDICIAL";3;"SEQ_USUARIO";"NUMBER";22;"Y";0;5;65;0;0,0153846153846154;"NO";1;"Usuario que cadastrou o deposito judicial";" (, )"
"SITRAM2";"DEPOSITO_JUDICIAL";4;"VALOR";"NUMBER";22;"Y";2;5;706;0;0,00141643059490085;"NO";1;"Valor do Boleto do deposito judicial";" (, )"
"SITRAM2";"DOC_CREDITO";1;"SEQ_DOC_CREDITO";"NUMBER";22;"N";0;6;65346485;0;0;"NO";254;"Identificador Único da instância de Documento de Crédito.";"PK_DOC_CREDITO (PRIMARY KEY, ENABLED); SYS_C00190724 (CHECK, ENABLED)"
"SITRAM2";"DOC_CREDITO";2;"SEQ_DAE_EMITIDO";"NUMBER";22;"Y";0;6;54120384;11226101;0;"NO";254;"DAE que foi emitido no Receita para documento de crédito do SITRAM.";"CKT_DOC_CREDITO (CHECK, ENABLED); DOC_CREDITO_UK2 (UNIQUE, ENABLED); FK_DAE_EMI_R_DOC_CRE (FOREIGN KEY, ENABLED)"
"SITRAM2";"DOC_CREDITO";3;"COD_IDENTIFICADOR_UNICO";"NUMBER";22;"Y";0;3;11192043;54154442;0;"NO";254;"Referência à GNRE incluída para pagamento da nota fiscal.";"CKT_DOC_CREDITO (CHECK, ENABLED); DOC_CREDITO_UK1 (UNIQUE, ENABLED); FK_GNR_R_DOC_CRE (FOREIGN KEY, ENABLED)"
"SITRAM2";"DOC_CREDITO";4;"COD_DEBITO_COPAF";"NUMBER";22;"Y";0;2;20607;65325878;0,000049;"NO";254;"Sequencial criado no COPAF.";"CKT_DOC_CREDITO (CHECK, ENABLED); DOC_CREDITO_UK3 (UNIQUE, ENABLED); FK_DEB_COP_R_DOC_CRE (FOREIGN KEY, ENABLED)"
"SITRAM2";"DOC_CREDITO";5;"COD_AUTO_INFRACAO";"NUMBER";22;"Y";0;2;7624;65338861;0,000131;"NO";254;"";"CKT_DOC_CREDITO (CHECK, ENABLED); DOC_CREDITO_UK4 (UNIQUE, ENABLED); FK_AUT_INF_R_DOC_CRE (FOREIGN KEY, ENABLED)"
"SITRAM2";"DOC_CREDITO";6;"SEQ_PROC_DOCUMENTO";"NUMBER";22;"Y";0;2;4693;65341792;0,000213;"NO";254;"Informação fiscal (ressarcimento) que pagou metade do imposto.";"CKT_DOC_CREDITO (CHECK, ENABLED); DOC_CREDITO_UK5 (UNIQUE, ENABLED)"
"SITRAM2";"DOC_CREDITO";7;"COD_BARRA_DEPOSITO_JUDICIAL";"VARCHAR2";48;"Y";;2;1134;65345351;0,000881834215167549;"NO";1;"credito boleto pago em deposito judicial";"CKT_DOC_CREDITO (CHECK, ENABLED); DOC_CREDITO_UK6 (UNIQUE, ENABLED)"
"SITRAM2";"DOC_CREDITO";8;"STA_REFIS";"NUMBER";22;"N";0;2;1;0;0,00000000765152096551176;"NO";1;"Indica se o documento credito foi gerado no REFIS";"SYS_C001564879 (CHECK, ENABLED)"
"SITRAM2";"DOC_CREDITO_LANC";1;"SEQ_DOC_CREDITO";"NUMBER";22;"N";0;6;62173184;0;0;"NO";254;"Identificador de Documento de Crédito.";"FK_DOC_CRE_R_DOC_CRE_LAN (FOREIGN KEY, ENABLED); PK_DOC_CREDITO_LANC (PRIMARY KEY, ENABLED); SYS_C00190729 (CHECK, ENABLED)"
"SITRAM2";"DOC_CREDITO_LANC";2;"SEQ_LANCAMENTO";"NUMBER";22;"N";0;11;70057984;0;0;"NO";254;"Identificador do lançamento.";"FK_LAN_R_DOC_CRE_LAN (FOREIGN KEY, ENABLED); PK_DOC_CREDITO_LANC (PRIMARY KEY, ENABLED); SYS_C00190730 (CHECK, ENABLED)"
"SITRAM2";"DOC_CREDITO_LANC";3;"VLR_PAGO";"NUMBER";22;"Y";2;4;1345920;0;0;"NO";254;"Valor pago do Lançamento";" (, )"
"SITRAM2";"DOC_CREDITO_LANC";4;"VLR_A_PAGAR";"NUMBER";22;"Y";2;5;1366784;0;0,000000731644502715864;"NO";1;"Valor a pagar.";" (, )"
"SITRAM2";"DOC_CREDITO_LANC";5;"VLR_JUROS";"NUMBER";22;"Y";2;2;59076;21576825;0,0000169273478231431;"NO";1;"Valor pago de juros atribuído ao lançamento.";" (, )"
"SITRAM2";"DOC_CREDITO_LANC";6;"VLR_MULTA";"NUMBER";22;"Y";2;3;70864;21406712;0,0000141115375931361;"NO";1;"Valor pago de multa atribuído ao lançamento.";" (, )"
"SITRAM2";"DOC_CREDITO_LANC";7;"VLR_DESCONTO_MULTA";"NUMBER";22;"Y";2;2;8973;4330028;0,0000000049138973153492;"NO";254;"";" (, )"
"SITRAM2";"DOC_CREDITO_LANC";8;"VLR_DESCONTO_JUROS";"NUMBER";22;"Y";2;2;11547;4155026;0,00000000490546049372675;"NO";254;"";" (, )"
"SITRAM2";"ESTRUTURA_DOCUMENTO_FISCAL";1;"SEQ_ESTRUTURA_DOCUMENTO_FISCAL";"NUMBER";22;"Y";0;7;495092447;0;0,00000000201982479445904;"NO";1;"Chave primaria";" (, )"
"SITRAM2";"ESTRUTURA_DOCUMENTO_FISCAL";2;"NUM_CHAVE";"VARCHAR2";100;"Y";;45;419299328;0;0;"NO";254;"Chave do Documento";" (, )"
"SITRAM2";"ESTRUTURA_DOCUMENTO_FISCAL";3;"NUM_CHAVE_PAI";"VARCHAR2";100;"Y";;45;216547328;0;0;"NO";254;"Chave Documento Pai";" (, )"
"SITRAM2";"ESTRUTURA_DOCUMENTO_FISCAL";4;"TIP_DOCUMENTO_FISCAL";"VARCHAR2";4;"Y";;5;3;0;0,00000000100991239722952;"NO";3;"Tipo Documento Fiscal, MDFE, CTE, NFE";" (, )"
"SITRAM2";"ESTRUTURA_DOCUMENTO_FISCAL";5;"STA_DOCUMENTO_FISCAL";"NUMBER";22;"Y";0;3;10;16830590;0,00000000104545238697553;"NO";10;"Situção Documento Fiscal";" (, )"
"SITRAM2";"ESTRUTURA_DOCUMENTO_FISCAL";6;"DAT_PROCESSAMENTO";"DATE";7;"Y";;8;27475968;24908925;0,0000000363954420095408;"NO";1;"Data de processamento com sucesso";" (, )"
"SITRAM2";"ESTRUTURA_DOCUMENTO_FISCAL";7;"SEQ_ACAO_FISCAL";"NUMBER";22;"Y";0;8;4140800;20242416;0,000000241499227202473;"NO";1;"Sequencial da Ação Fiscal";" (, )"
"SITRAM2";"FRETE";1;"SEQ_FRETE";"NUMBER";22;"N";0;10;1257627;0;0,000000795148322992429;"NO";1;"Identificador único do frete cobrado.";"PK_FRETE (PRIMARY KEY, ENABLED); SYS_C00190732 (CHECK, ENABLED)"
"SITRAM2";"FRETE";2;"SEQ_ACAO_FISCAL";"NUMBER";22;"Y";0;0;0;1257627;0;"NO";0;"Identificador único de instância de Ação Fiscal.";"FK_ACA_FIS_R_FRE (FOREIGN KEY, ENABLED)"
"SITRAM2";"FRETE";3;"NUM_PLACA_PRINCIPAL";"VARCHAR2";7;"Y";;8;202720;0;0,00000493291239147593;"NO";1;"Número da placa principal.";" (, )"
"SITRAM2";"FRETE";4;"COD_UF_PLACA_PRINCIPAL";"NUMBER";22;"Y";0;2;27;1098523;0,037037037037037;"NO";1;"UF da Placa Principal.";"FK_UNI_FED_R_FRE_PRI (FOREIGN KEY, ENABLED)"
"SITRAM2";"FRETE";5;"NUM_PLACA_SECUNDARIA1";"VARCHAR2";7;"Y";;2;34372;1167921;0,0000290934481554754;"NO";1;"Número da placa secundária.";" (, )"
"SITRAM2";"FRETE";6;"COD_UF_PLACA_SECUNDARIA1";"NUMBER";22;"Y";0;2;27;1242800;0,037037037037037;"NO";1;"UF da Placa Secundária.";"FK_UNI_FED_R_FRE_PS1 (FOREIGN KEY, ENABLED)"
"SITRAM2";"FRETE";7;"TIP_RESPONSAVEL";"NUMBER";22;"N";0;3;3;0;0,000000397574161496215;"NO";3;"Tipo do responsável pelo frete: PF, PJ sem CGF e PJ com CGF.";"CKC_TIP_RES_FRE (CHECK, ENABLED); SYS_C00190734 (CHECK, ENABLED)"
"SITRAM2";"FRETE";8;"COD_RESPONSAVEL";"NUMBER";22;"N";0;9;92592;0;0,00001;"NO";254;"CPF, CNPJ ou IE do responsável pelo frete.";"SYS_C00190735 (CHECK, ENABLED)"
"SITRAM2";"FRETE";9;"NOM_RESPONSAVEL";"VARCHAR2";150;"N";;32;121888;0;0,00000820425308479916;"NO";1;"Nome do responsável pelo frete.";"SYS_C00190736 (CHECK, ENABLED)"
"SITRAM2";"FRETE";10;"COD_UF_RESP";"NUMBER";22;"N";0;3;27;0;0,037037037037037;"NO";1;"UF do responsável pelo Frete.";"FK_UNI_FED_R_FRE_RES (FOREIGN KEY, ENABLED); SYS_C00190737 (CHECK, ENABLED)"
"SITRAM2";"FRETE";11;"SEQ_CONTRIBUINTE_RESP";"NUMBER";22;"Y";0;3;14216;710724;0,000048;"NO";254;"Contribuinte responsável pelo frete, quando for o caso.";"FK_CON_R_FRE (FOREIGN KEY, ENABLED)"
"SITRAM2";"FRETE";12;"STA_CREDITO_PRESUMIDO";"NUMBER";22;"Y";0;3;2;0;0,5;"NO";1;"Indica se a redução referente ao crédito presumido deve ser utilizada.";"CKC_STA_CRE_PRE_FRE (CHECK, ENABLED)"
"SITRAM2";"FRETE";13;"VLR_REDUCAO_ADICIONAL";"NUMBER";22;"Y";2;3;2;0;0,5;"NO";1;"Valor da redução adicional (ex. para cerâmica).";" (, )"
"SITRAM2";"FRETE";14;"VLR_BC";"NUMBER";22;"Y";2;3;68168;497595;0,0000146696397136486;"NO";1;"Valor total da Base de Cálculo do frete, caso informada pelo motorista.";" (, )"
"SITRAM2";"FRETE";15;"DAT_FRETE";"DATE";7;"N";;8;1247104;0;0,000000801857744021349;"NO";1;"Data de inclusão do frete.";"SYS_C00190738 (CHECK, ENABLED)"
"SITRAM2";"FRETE";16;"SEQ_USUARIO_AUTOR";"NUMBER";22;"Y";0;3;605;817194;0,001022;"NO";254;"Usuário que incluiu o frete no sistema.";"FK_USU_R_FRE (FOREIGN KEY, ENABLED)"
"SITRAM2";"FRETE";17;"COD_ORGAO_LOCAL";"NUMBER";22;"Y";0;3;61;817194;0,00000113524645065197;"NO";61;"Unidade Fiscal onde o frete foi incluído.";"FK_ORG_LOC_R_FRE (FOREIGN KEY, ENABLED)"
"SITRAM2";"FRETE";18;"VLR_ICMS_DEST";"NUMBER";22;"Y";2;5;65184;1;0,0000153411880216004;"NO";1;"Valor do ICMS Frete calculado.";" (, )"
"SITRAM2";"FRETE";19;"STA_ATIVO";"NUMBER";22;"Y";0;3;2;0;0,000000397574161496215;"NO";2;"Indica se o frete foi cancelado.";"CKC_STA_ATI_FRE (CHECK, ENABLED)"
"SITRAM2";"FRETE";20;"SEQ_USUARIO_CANCEL";"NUMBER";22;"Y";0;2;493;1239972;0,00202839756592292;"NO";1;"Usuário que cancelou o frete.";"FK_USU_R_FRE_CAN (FOREIGN KEY, ENABLED)"
"SITRAM2";"FRETE";21;"DSC_JUSTIFICATIVA_CANCEL";"VARCHAR2";1024;"Y";;2;13857;1239972;0,0000721656924298189;"NO";1;"Justificativa de cancelamento de frete.";" (, )"
"SITRAM2";"FRETE";22;"DAT_CANCEL";"DATE";7;"Y";;2;12428;1239972;0,0000804634695848085;"NO";1;"Data/Hora da ocorrência do cancelamento.";" (, )"
"SITRAM2";"FRETE";23;"DAT_ULT_ALTERACAO";"DATE";7;"Y";;2;11;1257555;0,0909090909090909;"NO";1;"Data da última atualização";" (, )"
"SITRAM2";"FRETE_AUTONOMO";1;"SEQ_FRETE_AUTONOMO";"NUMBER";22;"N";0;10;49423;0;0,0000202334945268397;"NO";1;"Identificador único de instância de frete autônomo.";"PK_FRETE_AUTONOMO (PRIMARY KEY, ENABLED); SYS_C00227262 (CHECK, ENABLED)"
"SITRAM2";"FRETE_AUTONOMO";2;"NUM_CODIGO_BARRA";"VARCHAR2";48;"N";;42;49000;0;0,0000204081632653061;"NO";1;"Numeração do código de barras, podendo ser de DAE ou GNRE.";"SYS_C00227263 (CHECK, ENABLED)"
"SITRAM2";"FRETE_AUTONOMO";3;"VLR_MERCADORIAS";"NUMBER";22;"N";2;5;27764;0;0,000036017864860971;"NO";1;"Valor das mercadorias";"SYS_C00227264 (CHECK, ENABLED)"
"SITRAM2";"FRETE_AUTONOMO";4;"VLR_ICMS_FRETE";"NUMBER";22;"N";2;5;12173;0;0,0000821490183192311;"NO";1;"Valor do ICMS Frete.";"SYS_C00227265 (CHECK, ENABLED)"
"SITRAM2";"FRETE_AUTONOMO";5;"VLR_FRETE";"NUMBER";22;"N";2;5;16329;0;0,0000612407373384775;"NO";1;"Valor da Prestação contida no Frete Autônomo..";"SYS_C00227397 (CHECK, ENABLED)"
"SITRAM2";"FRETE_PERCURSO";1;"SEQ_FRETE_PERCURSO";"NUMBER";22;"N";0;6;1406349;0;0,000000711061052413021;"NO";1;"Identificador único do percurso de frete.";"PK_FRETE_PERCURSO (PRIMARY KEY, ENABLED); SYS_C00190751 (CHECK, ENABLED)"
"SITRAM2";"FRETE_PERCURSO";2;"SEQ_FRETE";"NUMBER";22;"N";0;10;1281024;0;0,00000078062549960032;"NO";1;"Identificador único do frete cobrado.";"FK_FRE_R_FRE_PER (FOREIGN KEY, ENABLED); SYS_C00190752 (CHECK, ENABLED)"
"SITRAM2";"FRETE_PERCURSO";3;"COD_UF_ORIGEM";"NUMBER";22;"N";0;3;26;0;0,0384615384615385;"NO";1;"UF origem do percurso";"FK_MUN_R_FRE_PER_ORI (FOREIGN KEY, ENABLED); SYS_C00190753 (CHECK, ENABLED)"
"SITRAM2";"FRETE_PERCURSO";4;"COD_MUNICIPIO_ORIGEM";"NUMBER";22;"N";0;5;1653;0;0,000604960677555959;"NO";1;"Município origem do percurso";"FK_MUN_R_FRE_PER_ORI (FOREIGN KEY, ENABLED); SYS_C00190754 (CHECK, ENABLED)"
"SITRAM2";"FRETE_PERCURSO";5;"COD_UF_DESTINO";"NUMBER";22;"N";0;3;27;0;0,037037037037037;"NO";1;"UF destino do percurso";"FK_MUN_R_FRE_PER_DES (FOREIGN KEY, ENABLED); SYS_C00190755 (CHECK, ENABLED)"
"SITRAM2";"FRETE_PERCURSO";6;"COD_MUNICIPIO_DESTINO";"NUMBER";22;"N";0;5;2957;0;0,000338180588434224;"NO";1;"Município destino do percurso";"FK_MUN_R_FRE_PER_DES (FOREIGN KEY, ENABLED); SYS_C00190756 (CHECK, ENABLED)"
"SITRAM2";"FRETE_PERCURSO";7;"VLR_PESO";"NUMBER";22;"N";2;4;10903;0;0,0000917178758139961;"NO";1;"Peso da carga que vai percorrer o percurso.";"SYS_C00190757 (CHECK, ENABLED)"
"SITRAM2";"FRETE_PERCURSO";8;"VLR_FRETE_PERCURSO";"NUMBER";22;"N";2;5;65496;0;0,0000152681079760596;"NO";1;"Valor do frete para cada percurso.";"SYS_C00190758 (CHECK, ENABLED)"
"SITRAM2";"FRETE_PERCURSO";9;"VLR_DISTANCIA";"NUMBER";22;"N";2;4;4177;0;0,000239406272444338;"NO";1;"Distância entre as duas cidades. É redundado, para que se guarde o valor vigente na data do cálculo. Também serve para quando a distância não existir na tabela de distâncias, e for fornecida pelo fiscal, ficar guardada na memória do cálculo.";"SYS_C00190759 (CHECK, ENABLED)"
"SITRAM2";"FRETE_PERCURSO";10;"VLR_PRECO";"NUMBER";22;"N";2;5;304;0;0,00328947368421053;"NO";1;"Preço do frete para a faixa. É redundado, para que se guarde o valor vigente na data do cálculo. Também serve para quando o preço não existir na tabela de frete por tonelada, e for fornecida pelo fiscal, ficar guardada na memória do cálculo.";"SYS_C00190760 (CHECK, ENABLED)"
"SITRAM2";"FRETE_PERCURSO";11;"DSC_NOTAS_FISCAIS";"VARCHAR2";4000;"Y";;76;296864;902035;0,00000336854586612051;"NO";1;"Números das notas fiscais para as quais o frete foi calculado.";" (, )"
"SITRAM2";"FRETE_PERCURSO";12;"DSC_NOTAS_FISCAIS_LEG";"VARCHAR2";1024;"Y";;5;295744;909909;0,00000338130274832287;"NO";1;"Coluna para preservar dados das notas fiscais vinculadas ao frete, a coluna atual sera modificada para outro formato.";" (, )"
"SITRAM2";"FRETE_PERCURSO_NOTA_FISCAL";1;"SEQ_FRETE_PERCURSO_NOTA_FISCAL";"NUMBER";22;"N";0;6;2240367;0;0,000000446355440871964;"NO";1;"";"PK_FRETE_PERCURSO_NOTA_FISCAL (PRIMARY KEY, ENABLED); SYS_C001519639 (CHECK, ENABLED)"
"SITRAM2";"FRETE_PERCURSO_NOTA_FISCAL";2;"SEQ_FRETE_PERCURSO";"NUMBER";22;"Y";0;6;1344896;0;0,000000743551917769106;"NO";1;"";"FK_FRETE_PE_FK_NOTA_F_FRETE_PE (FOREIGN KEY, ENABLED)"
"SITRAM2";"FRETE_PERCURSO_NOTA_FISCAL";3;"NUM_DANFE";"VARCHAR2";100;"Y";;29;1049472;809293;0,00000095286010489084;"NO";1;"Numero do danfe, chave de acesso para nota fiscal";" (, )"
"SITRAM2";"FRETE_PERCURSO_NOTA_FISCAL";4;"NUM_NOTA_FISCAL";"NUMBER";22;"Y";0;5;523904;54323;0,00000190874664060591;"NO";1;"";" (, )"
"SITRAM2";"FRETE_PERCURSO_NOTA_FISCAL";5;"COD_EMITENTE";"VARCHAR2";20;"Y";;9;20774;976817;0,0000481370944449793;"NO";1;"Codigo do emitente da nota fiscal";" (, )"
"SITRAM2";"FRETE_PERCURSO_NOTA_FISCAL";6;"DAT_EMISSAO";"DATE";7;"Y";;8;612032;237689;0,00000163390149534665;"NO";1;"Data Emissao referente a nota fiscal";" (, )"
"SITRAM2";"FRETE_TONELADA";1;"SEQ_FRETE_TONELADA";"NUMBER";22;"N";0;4;249;0;0,00401606425702811;"NO";1;"Identificador único do Preço por tonelada.";"PK_FRETE_TONELADA (PRIMARY KEY, ENABLED); SYS_C00190762 (CHECK, ENABLED)"
"SITRAM2";"FRETE_TONELADA";2;"VLR_FAIXA_INICIO";"NUMBER";22;"N";2;4;50;0;0,00200803212851406;"NO";50;"Início da faixa em quilômetros.";"SYS_C00190763 (CHECK, ENABLED)"
"SITRAM2";"FRETE_TONELADA";3;"VLR_FAIXA_FIM";"NUMBER";22;"N";2;4;50;0;0,00200803212851406;"NO";50;"Fim da faixa em quilômetros.";"SYS_C00190764 (CHECK, ENABLED)"
"SITRAM2";"FRETE_TONELADA";4;"VLR_PRECO";"NUMBER";22;"N";2;5;246;0;0,0040650406504065;"NO";1;"Preço do frete para a faixa.";"SYS_C00190765 (CHECK, ENABLED)"
"SITRAM2";"FRETE_TONELADA";5;"DSC_INSTRUCAO_NORMATIVA";"VARCHAR2";10;"Y";;8;5;0;0,2;"NO";1;"Campo que informa de qual instrução normativa aquela informação foi obtida.
";" (, )"
